library/src/amd_detail/rocblaslt/src/Tensile/Logic/streamk/aquavanjaram/aquavanjaram942_Cijk_Ailk_Bjlk_HHS_BH_UserArgs.yaml
- {MinimumRequiredVersion: 4.33.0}
- aquavanjaram942
- gfx942
- [Device 0049, Device 0050]
    SolutionIndex: 0
    SolutionNameMin: Cijk_Ailk_Bjlk_HHS_BH_UserArgs_MT256x256x16_MI16x16x1_SN_LDSB0_GSU0_GSUC0_GSUWGMRR0_K1_LBSPPA2048_LBSPPB2048_MIWT8_8_NLCB1_PLR0_SU0_SUM0_SUS0_SVW4_SKXCCM0_VWA4_VWB4_WGM1
    SolutionIndex: 1
    SolutionNameMin: Cijk_Ailk_Bjlk_HHS_BH_UserArgs_MT256x256x16_MI16x16x1_SN_LDSB0_GSU0_GSUC0_GSUWGMRR0_K1_LBSPPA2048_LBSPPB2048_MIWT8_8_NLCB2_PLR1_SU0_SUM0_SUS0_SVW4_SKXCCM0_VWA4_VWB4_WGM1
    SolutionIndex: 2
    SolutionNameMin: Cijk_Ailk_Bjlk_HHS_BH_UserArgs_MT256x256x16_MI16x16x1_SN_LDSB0_GSU0_GSUC0_GSUWGMRR0_K1_LBSPPA2048_LBSPPB2048_MIWT8_8_NLCB1_PLR1_SU0_SUM0_SUS0_SVW4_SKXCCM8_VWA4_VWB4_WGM1
    SolutionIndex: 3
    SolutionNameMin: Cijk_Ailk_Bjlk_HHS_BH_UserArgs_MT256x256x16_MI16x16x1_SN_LDSB0_GSU0_GSUC0_GSUWGMRR0_K1_LBSPPA2048_LBSPPB2048_MIWT8_8_NLCB2_PLR1_SU0_SUM0_SUS0_SVW4_SKXCCM8_VWA4_VWB4_WGM1
    SolutionIndex: 4
    SolutionNameMin: Cijk_Ailk_Bjlk_HHS_BH_UserArgs_MT256x256x16_MI16x16x1_SN_LDSB0_GSU0_GSUC0_GSUWGMRR0_K1_LBSPPA2048_LBSPPB2048_MIWT8_8_NLCB2_PLR0_SU0_SUM0_SUS0_SVW4_SKXCCM8_VWA4_VWB4_WGM1
    SolutionIndex: 5
    SolutionNameMin: Cijk_Ailk_Bjlk_HHS_BH_UserArgs_MT256x256x16_MI16x16x1_SN_LDSB0_GSU0_GSUC0_GSUWGMRR0_K1_LBSPPA2048_LBSPPB2048_MIWT8_8_NLCB1_PLR1_SU0_SUM0_SUS0_SVW4_SKXCCM8_VWA4_VWB4_WGM8
    SolutionIndex: 6
    SolutionNameMin: Cijk_Ailk_Bjlk_HHS_BH_UserArgs_MT256x256x16_MI16x16x1_SN_LDSB0_GSU0_GSUC0_GSUWGMRR0_K1_LBSPPA2048_LBSPPB2048_MIWT8_8_NLCB2_PLR1_SU0_SUM0_SUS0_SVW4_SKXCCM8_VWA4_VWB4_WGM8
    SolutionIndex: 7
    SolutionNameMin: Cijk_Ailk_Bjlk_HHS_BH_UserArgs_MT128x256x16_MI16x16x1_SN_LDSB0_GSU0_GSUC0_GSUWGMRR0_K1_LBSPPA1024_LBSPPB2048_MIWT4_8_NLCB1_PLR0_SU0_SUM0_SUS0_SVW4_SKXCCM8_VWA4_VWB4_WGM8
    SolutionIndex: 8
    SolutionNameMin: Cijk_Ailk_Bjlk_HHS_BH_UserArgs_MT256x128x16_MI16x16x1_SN_LDSB0_GSU0_GSUC0_GSUWGMRR0_K1_LBSPPA2048_LBSPPB1024_MIWT8_4_NLCB1_PLR1_SU0_SUM0_SUS0_SVW4_SKXCCM8_VWA4_VWB4_WGM8
    SolutionIndex: 9
    SolutionNameMin: Cijk_Ailk_Bjlk_HHS_BH_UserArgs_MT256x256x16_MI16x16x1_SN_LDSB1_GSU0_GSUC0_GSUWGMRR0_K1_LBSPPA2048_LBSPPB2048_MIWT8_8_NLCB1_PLR1_SU0_SUM0_SUS0_SVW4_SKXCCM8_VWA4_VWB4_WGM1
    SolutionIndex: 10
    SolutionNameMin: Cijk_Ailk_Bjlk_HHS_BH_UserArgs_MT256x256x16_MI16x16x1_SN_LDSB1_GSU0_GSUC0_GSUWGMRR0_K1_LBSPPA2048_LBSPPB2048_MIWT8_8_NLCB2_PLR0_SU0_SUM0_SUS0_SVW4_SKXCCM8_VWA4_VWB4_WGM1
    SolutionIndex: 11
    SolutionNameMin: Cijk_Ailk_Bjlk_HHS_BH_UserArgs_MT256x256x16_MI16x16x1_SN_LDSB1_GSU0_GSUC0_GSUWGMRR0_K1_LBSPPA2048_LBSPPB2048_MIWT8_8_NLCB1_PLR1_SU0_SUM0_SUS0_SVW4_SKXCCM8_VWA4_VWB4_WGM8
    SolutionIndex: 12
    SolutionNameMin: Cijk_Ailk_Bjlk_HHS_BH_UserArgs_MT256x256x16_MI16x16x1_SN_LDSB1_GSU0_GSUC0_GSUWGMRR0_K1_LBSPPA2048_LBSPPB2048_MIWT8_8_NLCB2_PLR0_SU0_SUM0_SUS0_SVW4_SKXCCM8_VWA4_VWB4_WGM8
    SolutionIndex: 13
    SolutionNameMin: Cijk_Ailk_Bjlk_HHS_BH_UserArgs_MT128x256x16_MI16x16x1_SN_LDSB1_GSU0_GSUC0_GSUWGMRR0_K1_LBSPPA1024_LBSPPB2048_MIWT4_8_NLCB2_PLR1_SU0_SUM0_SUS0_SVW4_SKXCCM8_VWA4_VWB4_WGM1
    SolutionIndex: 14
    SolutionNameMin: Cijk_Ailk_Bjlk_HHS_BH_UserArgs_MT256x128x16_MI16x16x1_SN_LDSB1_GSU0_GSUC0_GSUWGMRR0_K1_LBSPPA2048_LBSPPB1024_MIWT8_4_NLCB1_PLR0_SU0_SUM0_SUS0_SVW4_SKXCCM8_VWA4_VWB4_WGM1
    SolutionIndex: 15
    SolutionNameMin: Cijk_Ailk_Bjlk_HHS_BH_UserArgs_MT256x128x16_MI16x16x1_SN_LDSB1_GSU0_GSUC0_GSUWGMRR0_K1_LBSPPA2048_LBSPPB1024_MIWT8_4_NLCB1_PLR0_SU0_SUM0_SUS0_SVW4_SKXCCM8_VWA4_VWB4_WGM8
    SolutionIndex: 16
    SolutionNameMin: Cijk_Ailk_Bjlk_HHS_BH_UserArgs_MT64x128x32_MI16x16x1_SN_LDSB0_GSU0_GSUC0_GSUWGMRR0_K1_LBSPPA512_LBSPPB1024_MIWT2_4_NLCB2_PLR0_SU0_SUM0_SUS0_SVW2_SKXCCM0_VWA2_VWB2_WGM1
    SolutionIndex: 17
    SolutionNameMin: Cijk_Ailk_Bjlk_HHS_BH_UserArgs_MT64x128x32_MI16x16x1_SN_LDSB0_GSU0_GSUC0_GSUWGMRR0_K1_LBSPPA512_LBSPPB1024_MIWT2_4_NLCB2_PLR0_SU0_SUM0_SUS0_SVW2_SKXCCM0_VWA2_VWB2_WGM8
    SolutionIndex: 18
    SolutionNameMin: Cijk_Ailk_Bjlk_HHS_BH_UserArgs_MT128x64x32_MI16x16x1_SN_LDSB0_GSU0_GSUC0_GSUWGMRR0_K1_LBSPPA1024_LBSPPB512_MIWT4_2_NLCB1_PLR0_SU0_SUM0_SUS0_SVW2_SKXCCM0_VWA2_VWB2_WGM1
    SolutionIndex: 19
    SolutionNameMin: Cijk_Ailk_Bjlk_HHS_BH_UserArgs_MT64x64x32_MI16x16x1_SN_LDSB0_GSU0_GSUC0_GSUWGMRR0_K1_LBSPPA512_LBSPPB512_MIWT2_2_NLCB1_PLR0_SU0_SUM0_SUS0_SVW2_SKXCCM0_VWA2_VWB2_WGM1
    SolutionIndex: 20
    SolutionNameMin: Cijk_Ailk_Bjlk_HHS_BH_UserArgs_MT64x128x32_MI16x16x1_SN_LDSB0_GSU0_GSUC0_GSUWGMRR0_K1_LBSPPA512_LBSPPB1024_MIWT2_4_NLCB2_PLR0_SU0_SUM0_SUS0_SVW2_SKXCCM8_VWA2_VWB2_WGM8
    SolutionIndex: 21
    SolutionNameMin: Cijk_Ailk_Bjlk_HHS_BH_UserArgs_MT64x64x32_MI16x16x1_SN_LDSB0_GSU0_GSUC0_GSUWGMRR0_K1_LBSPPA512_LBSPPB512_MIWT2_2_NLCB1_PLR0_SU0_SUM0_SUS0_SVW2_SKXCCM8_VWA2_VWB2_WGM1
    SolutionIndex: 22
    SolutionNameMin: Cijk_Ailk_Bjlk_HHS_BH_UserArgs_MT64x64x32_MI16x16x1_SN_LDSB0_GSU0_GSUC0_GSUWGMRR0_K1_LBSPPA512_LBSPPB512_MIWT2_2_NLCB1_PLR0_SU0_SUM0_SUS0_SVW2_SKXCCM8_VWA2_VWB2_WGM8
    SolutionIndex: 23
    SolutionNameMin: Cijk_Ailk_Bjlk_HHS_BH_UserArgs_MT256x256x32_MI16x16x1_SN_LDSB0_GSU0_GSUC0_GSUWGMRR0_K1_LBSPPA2048_LBSPPB2048_MIWT8_8_NLCB2_PLR0_SU0_SUM0_SUS0_SVW4_SKXCCM0_VWA4_VWB4_WGM1
    SolutionIndex: 24
    SolutionNameMin: Cijk_Ailk_Bjlk_HHS_BH_UserArgs_MT256x256x32_MI16x16x1_SN_LDSB0_GSU0_GSUC0_GSUWGMRR0_K1_LBSPPA2048_LBSPPB2048_MIWT8_8_NLCB1_PLR0_SU0_SUM0_SUS0_SVW4_SKXCCM0_VWA4_VWB4_WGM8
    SolutionIndex: 25
    SolutionNameMin: Cijk_Ailk_Bjlk_HHS_BH_UserArgs_MT128x256x32_MI16x16x1_SN_LDSB0_GSU0_GSUC0_GSUWGMRR0_K1_LBSPPA1024_LBSPPB2048_MIWT4_8_NLCB1_PLR0_SU0_SUM0_SUS0_SVW4_SKXCCM0_VWA4_VWB4_WGM1
    SolutionIndex: 26
    SolutionNameMin: Cijk_Ailk_Bjlk_HHS_BH_UserArgs_MT128x256x32_MI16x16x1_SN_LDSB0_GSU0_GSUC0_GSUWGMRR0_K1_LBSPPA1024_LBSPPB2048_MIWT4_8_NLCB2_PLR0_SU0_SUM0_SUS0_SVW4_SKXCCM0_VWA4_VWB4_WGM1
    SolutionIndex: 27
    SolutionNameMin: Cijk_Ailk_Bjlk_HHS_BH_UserArgs_MT128x256x32_MI16x16x1_SN_LDSB0_GSU0_GSUC0_GSUWGMRR0_K1_LBSPPA1024_LBSPPB2048_MIWT4_8_NLCB2_PLR0_SU0_SUM0_SUS0_SVW4_SKXCCM0_VWA4_VWB4_WGM8
    SolutionIndex: 28
    SolutionNameMin: Cijk_Ailk_Bjlk_HHS_BH_UserArgs_MT256x128x32_MI16x16x1_SN_LDSB0_GSU0_GSUC0_GSUWGMRR0_K1_LBSPPA2048_LBSPPB1024_MIWT8_4_NLCB2_PLR0_SU0_SUM0_SUS0_SVW4_SKXCCM0_VWA4_VWB4_WGM1
    SolutionIndex: 29
    SolutionNameMin: Cijk_Ailk_Bjlk_HHS_BH_UserArgs_MT256x128x32_MI16x16x1_SN_LDSB0_GSU0_GSUC0_GSUWGMRR0_K1_LBSPPA2048_LBSPPB1024_MIWT8_4_NLCB1_PLR0_SU0_SUM0_SUS0_SVW4_SKXCCM0_VWA4_VWB4_WGM8
    SolutionIndex: 30
    SolutionNameMin: Cijk_Ailk_Bjlk_HHS_BH_UserArgs_MT256x128x32_MI16x16x1_SN_LDSB0_GSU0_GSUC0_GSUWGMRR0_K1_LBSPPA2048_LBSPPB1024_MIWT8_4_NLCB2_PLR0_SU0_SUM0_SUS0_SVW4_SKXCCM0_VWA4_VWB4_WGM8
    SolutionIndex: 31
    SolutionNameMin: Cijk_Ailk_Bjlk_HHS_BH_UserArgs_MT128x128x32_MI16x16x1_SN_LDSB0_GSU0_GSUC0_GSUWGMRR0_K1_LBSPPA1024_LBSPPB1024_MIWT4_4_NLCB1_PLR0_SU0_SUM0_SUS0_SVW4_SKXCCM0_VWA4_VWB4_WGM1
    SolutionIndex: 32
    SolutionNameMin: Cijk_Ailk_Bjlk_HHS_BH_UserArgs_MT128x128x32_MI16x16x1_SN_LDSB0_GSU0_GSUC0_GSUWGMRR0_K1_LBSPPA1024_LBSPPB1024_MIWT4_4_NLCB2_PLR0_SU0_SUM0_SUS0_SVW4_SKXCCM0_VWA4_VWB4_WGM8
    SolutionIndex: 33
    SolutionNameMin: Cijk_Ailk_Bjlk_HHS_BH_UserArgs_MT256x256x32_MI16x16x1_SN_LDSB0_GSU0_GSUC0_GSUWGMRR0_K1_LBSPPA2048_LBSPPB2048_MIWT8_8_NLCB1_PLR0_SU0_SUM0_SUS0_SVW4_SKXCCM8_VWA4_VWB4_WGM1
    SolutionIndex: 34
    SolutionNameMin: Cijk_Ailk_Bjlk_HHS_BH_UserArgs_MT256x256x32_MI16x16x1_SN_LDSB0_GSU0_GSUC0_GSUWGMRR0_K1_LBSPPA2048_LBSPPB2048_MIWT8_8_NLCB2_PLR0_SU0_SUM0_SUS0_SVW4_SKXCCM8_VWA4_VWB4_WGM1
    SolutionIndex: 35
    SolutionNameMin: Cijk_Ailk_Bjlk_HHS_BH_UserArgs_MT256x256x32_MI16x16x1_SN_LDSB0_GSU0_GSUC0_GSUWGMRR0_K1_LBSPPA2048_LBSPPB2048_MIWT8_8_NLCB1_PLR0_SU0_SUM0_SUS0_SVW4_SKXCCM8_VWA4_VWB4_WGM8
    SolutionIndex: 36
    SolutionNameMin: Cijk_Ailk_Bjlk_HHS_BH_UserArgs_MT256x256x32_MI16x16x1_SN_LDSB0_GSU0_GSUC0_GSUWGMRR0_K1_LBSPPA2048_LBSPPB2048_MIWT8_8_NLCB2_PLR0_SU0_SUM0_SUS0_SVW4_SKXCCM8_VWA4_VWB4_WGM8
    SolutionIndex: 37
    SolutionNameMin: Cijk_Ailk_Bjlk_HHS_BH_UserArgs_MT128x256x32_MI16x16x1_SN_LDSB0_GSU0_GSUC0_GSUWGMRR0_K1_LBSPPA1024_LBSPPB2048_MIWT4_8_NLCB1_PLR0_SU0_SUM0_SUS0_SVW4_SKXCCM8_VWA4_VWB4_WGM1
    SolutionIndex: 38
    SolutionNameMin: Cijk_Ailk_Bjlk_HHS_BH_UserArgs_MT128x256x32_MI16x16x1_SN_LDSB0_GSU0_GSUC0_GSUWGMRR0_K1_LBSPPA1024_LBSPPB2048_MIWT4_8_NLCB2_PLR0_SU0_SUM0_SUS0_SVW4_SKXCCM8_VWA4_VWB4_WGM1
    SolutionIndex: 39
    SolutionNameMin: Cijk_Ailk_Bjlk_HHS_BH_UserArgs_MT128x256x32_MI16x16x1_SN_LDSB0_GSU0_GSUC0_GSUWGMRR0_K1_LBSPPA1024_LBSPPB2048_MIWT4_8_NLCB1_PLR0_SU0_SUM0_SUS0_SVW4_SKXCCM8_VWA4_VWB4_WGM8
    SolutionIndex: 40
    SolutionNameMin: Cijk_Ailk_Bjlk_HHS_BH_UserArgs_MT128x256x32_MI16x16x1_SN_LDSB0_GSU0_GSUC0_GSUWGMRR0_K1_LBSPPA1024_LBSPPB2048_MIWT4_8_NLCB2_PLR0_SU0_SUM0_SUS0_SVW4_SKXCCM8_VWA4_VWB4_WGM8
    SolutionIndex: 41
    SolutionNameMin: Cijk_Ailk_Bjlk_HHS_BH_UserArgs_MT256x128x32_MI16x16x1_SN_LDSB0_GSU0_GSUC0_GSUWGMRR0_K1_LBSPPA2048_LBSPPB1024_MIWT8_4_NLCB1_PLR0_SU0_SUM0_SUS0_SVW4_SKXCCM8_VWA4_VWB4_WGM1
    SolutionIndex: 42
    SolutionNameMin: Cijk_Ailk_Bjlk_HHS_BH_UserArgs_MT256x128x32_MI16x16x1_SN_LDSB0_GSU0_GSUC0_GSUWGMRR0_K1_LBSPPA2048_LBSPPB1024_MIWT8_4_NLCB2_PLR0_SU0_SUM0_SUS0_SVW4_SKXCCM8_VWA4_VWB4_WGM1
    SolutionIndex: 43
    SolutionNameMin: Cijk_Ailk_Bjlk_HHS_BH_UserArgs_MT256x128x32_MI16x16x1_SN_LDSB0_GSU0_GSUC0_GSUWGMRR0_K1_LBSPPA2048_LBSPPB1024_MIWT8_4_NLCB1_PLR0_SU0_SUM0_SUS0_SVW4_SKXCCM8_VWA4_VWB4_WGM8
    SolutionIndex: 44
    SolutionNameMin: Cijk_Ailk_Bjlk_HHS_BH_UserArgs_MT256x128x32_MI16x16x1_SN_LDSB0_GSU0_GSUC0_GSUWGMRR0_K1_LBSPPA2048_LBSPPB1024_MIWT8_4_NLCB2_PLR0_SU0_SUM0_SUS0_SVW4_SKXCCM8_VWA4_VWB4_WGM8
    SolutionIndex: 45
    SolutionNameMin: Cijk_Ailk_Bjlk_HHS_BH_UserArgs_MT128x128x32_MI16x16x1_SN_LDSB0_GSU0_GSUC0_GSUWGMRR0_K1_LBSPPA1024_LBSPPB1024_MIWT4_4_NLCB1_PLR0_SU0_SUM0_SUS0_SVW4_SKXCCM8_VWA4_VWB4_WGM1
    SolutionIndex: 46
    SolutionNameMin: Cijk_Ailk_Bjlk_HHS_BH_UserArgs_MT128x128x32_MI16x16x1_SN_LDSB0_GSU0_GSUC0_GSUWGMRR0_K1_LBSPPA1024_LBSPPB1024_MIWT4_4_NLCB2_PLR0_SU0_SUM0_SUS0_SVW4_SKXCCM8_VWA4_VWB4_WGM1
    SolutionIndex: 47
    SolutionNameMin: Cijk_Ailk_Bjlk_HHS_BH_UserArgs_MT128x128x32_MI16x16x1_SN_LDSB0_GSU0_GSUC0_GSUWGMRR0_K1_LBSPPA1024_LBSPPB1024_MIWT4_4_NLCB1_PLR0_SU0_SUM0_SUS0_SVW4_SKXCCM8_VWA4_VWB4_WGM8
    SolutionIndex: 48
    SolutionNameMin: Cijk_Ailk_Bjlk_HHS_BH_UserArgs_MT128x128x32_MI16x16x1_SN_LDSB0_GSU0_GSUC0_GSUWGMRR0_K1_LBSPPA1024_LBSPPB1024_MIWT4_4_NLCB2_PLR0_SU0_SUM0_SUS0_SVW4_SKXCCM8_VWA4_VWB4_WGM8
    SolutionIndex: 49
    SolutionNameMin: Cijk_Ailk_Bjlk_HHS_BH_UserArgs_MT64x64x64_MI16x16x1_SN_LDSB0_GSU0_GSUC0_GSUWGMRR0_K1_LBSPPA512_LBSPPB512_MIWT2_2_NLCB1_PLR0_SU0_SUM0_SUS0_SVW1_SKXCCM0_VWA1_VWB1_WGM1
    SolutionIndex: 50
    SolutionNameMin: Cijk_Ailk_Bjlk_HHS_BH_UserArgs_MT32x64x64_MI16x16x1_SN_LDSB0_GSU0_GSUC0_GSUWGMRR0_K1_LBSPPA256_LBSPPB512_MIWT1_2_NLCB1_PLR0_SU0_SUM0_SUS0_SVW1_SKXCCM0_VWA1_VWB1_WGM1
    SolutionIndex: 51
    SolutionNameMin: Cijk_Ailk_Bjlk_HHS_BH_UserArgs_MT32x64x64_MI16x16x1_SN_LDSB0_GSU0_GSUC0_GSUWGMRR0_K1_LBSPPA256_LBSPPB512_MIWT1_2_NLCB2_PLR0_SU0_SUM0_SUS0_SVW1_SKXCCM0_VWA1_VWB1_WGM1
    SolutionIndex: 52
    SolutionNameMin: Cijk_Ailk_Bjlk_HHS_BH_UserArgs_MT64x32x64_MI16x16x1_SN_LDSB0_GSU0_GSUC0_GSUWGMRR0_K1_LBSPPA512_LBSPPB256_MIWT2_1_NLCB1_PLR0_SU0_SUM0_SUS0_SVW1_SKXCCM0_VWA1_VWB1_WGM1
    SolutionIndex: 53
    SolutionNameMin: Cijk_Ailk_Bjlk_HHS_BH_UserArgs_MT64x32x64_MI16x16x1_SN_LDSB0_GSU0_GSUC0_GSUWGMRR0_K1_LBSPPA512_LBSPPB256_MIWT2_1_NLCB1_PLR0_SU0_SUM0_SUS0_SVW1_SKXCCM0_VWA1_VWB1_WGM8
    SolutionIndex: 54
    SolutionNameMin: Cijk_Ailk_Bjlk_HHS_BH_UserArgs_MT32x32x64_MI16x16x1_SN_LDSB0_GSU0_GSUC0_GSUWGMRR0_K1_LBSPPA256_LBSPPB256_MIWT1_1_NLCB1_PLR0_SU0_SUM0_SUS0_SVW1_SKXCCM0_VWA1_VWB1_WGM1
    SolutionIndex: 55
    SolutionNameMin: Cijk_Ailk_Bjlk_HHS_BH_UserArgs_MT128x64x64_MI16x16x1_SN_LDSB0_GSU0_GSUC0_GSUWGMRR0_K1_LBSPPA1024_LBSPPB512_MIWT4_2_NLCB2_PLR0_SU0_SUM0_SUS0_SVW1_SKXCCM8_VWA1_VWB1_WGM8
    SolutionIndex: 56
    SolutionNameMin: Cijk_Ailk_Bjlk_HHS_BH_UserArgs_MT32x64x64_MI16x16x1_SN_LDSB0_GSU0_GSUC0_GSUWGMRR0_K1_LBSPPA256_LBSPPB512_MIWT1_2_NLCB1_PLR0_SU0_SUM0_SUS0_SVW1_SKXCCM8_VWA1_VWB1_WGM1
    SolutionIndex: 57
    SolutionNameMin: Cijk_Ailk_Bjlk_HHS_BH_UserArgs_MT32x64x64_MI16x16x1_SN_LDSB0_GSU0_GSUC0_GSUWGMRR0_K1_LBSPPA256_LBSPPB512_MIWT1_2_NLCB2_PLR0_SU0_SUM0_SUS0_SVW1_SKXCCM8_VWA1_VWB1_WGM1
    SolutionIndex: 58
    SolutionNameMin: Cijk_Ailk_Bjlk_HHS_BH_UserArgs_MT64x32x64_MI16x16x1_SN_LDSB0_GSU0_GSUC0_GSUWGMRR0_K1_LBSPPA512_LBSPPB256_MIWT2_1_NLCB1_PLR0_SU0_SUM0_SUS0_SVW1_SKXCCM8_VWA1_VWB1_WGM1
    SolutionIndex: 59
    SolutionNameMin: Cijk_Ailk_Bjlk_HHS_BH_UserArgs_MT32x32x64_MI16x16x1_SN_LDSB0_GSU0_GSUC0_GSUWGMRR0_K1_LBSPPA256_LBSPPB256_MIWT1_1_NLCB1_PLR0_SU0_SUM0_SUS0_SVW1_SKXCCM8_VWA1_VWB1_WGM1
    SolutionIndex: 60
    SolutionNameMin: Cijk_Ailk_Bjlk_HHS_BH_UserArgs_MT32x32x64_MI16x16x1_SN_LDSB0_GSU0_GSUC0_GSUWGMRR0_K1_LBSPPA256_LBSPPB256_MIWT1_1_NLCB1_PLR0_SU0_SUM0_SUS0_SVW1_SKXCCM8_VWA1_VWB1_WGM8
    SolutionIndex: 61
    SolutionNameMin: Cijk_Ailk_Bjlk_HHS_BH_UserArgs_MT64x128x64_MI16x16x1_SN_LDSB0_GSU0_GSUC0_GSUWGMRR0_K1_LBSPPA512_LBSPPB1024_MIWT2_4_NLCB1_PLR0_SU0_SUM0_SUS0_SVW2_SKXCCM0_VWA2_VWB2_WGM1
    SolutionIndex: 62
    SolutionNameMin: Cijk_Ailk_Bjlk_HHS_BH_UserArgs_MT64x128x64_MI16x16x1_SN_LDSB0_GSU0_GSUC0_GSUWGMRR0_K1_LBSPPA512_LBSPPB1024_MIWT2_4_NLCB2_PLR0_SU0_SUM0_SUS0_SVW2_SKXCCM0_VWA2_VWB2_WGM1
    SolutionIndex: 63
    SolutionNameMin: Cijk_Ailk_Bjlk_HHS_BH_UserArgs_MT64x128x64_MI16x16x1_SN_LDSB0_GSU0_GSUC0_GSUWGMRR0_K1_LBSPPA512_LBSPPB1024_MIWT2_4_NLCB2_PLR0_SU0_SUM0_SUS0_SVW2_SKXCCM0_VWA2_VWB2_WGM8
    SolutionIndex: 64
    SolutionNameMin: Cijk_Ailk_Bjlk_HHS_BH_UserArgs_MT128x64x64_MI16x16x1_SN_LDSB0_GSU0_GSUC0_GSUWGMRR0_K1_LBSPPA1024_LBSPPB512_MIWT4_2_NLCB2_PLR0_SU0_SUM0_SUS0_SVW2_SKXCCM0_VWA2_VWB2_WGM1
    SolutionIndex: 65
    SolutionNameMin: Cijk_Ailk_Bjlk_HHS_BH_UserArgs_MT128x64x64_MI16x16x1_SN_LDSB0_GSU0_GSUC0_GSUWGMRR0_K1_LBSPPA1024_LBSPPB512_MIWT4_2_NLCB1_PLR0_SU0_SUM0_SUS0_SVW2_SKXCCM0_VWA2_VWB2_WGM8
    SolutionIndex: 66
    SolutionNameMin: Cijk_Ailk_Bjlk_HHS_BH_UserArgs_MT64x64x64_MI16x16x1_SN_LDSB0_GSU0_GSUC0_GSUWGMRR0_K1_LBSPPA512_LBSPPB512_MIWT2_2_NLCB1_PLR0_SU0_SUM0_SUS0_SVW2_SKXCCM0_VWA2_VWB2_WGM1
    SolutionIndex: 67
    SolutionNameMin: Cijk_Ailk_Bjlk_HHS_BH_UserArgs_MT64x64x64_MI16x16x1_SN_LDSB0_GSU0_GSUC0_GSUWGMRR0_K1_LBSPPA512_LBSPPB512_MIWT2_2_NLCB2_PLR0_SU0_SUM0_SUS0_SVW2_SKXCCM0_VWA2_VWB2_WGM1
    SolutionIndex: 68
    SolutionNameMin: Cijk_Ailk_Bjlk_HHS_BH_UserArgs_MT64x128x64_MI16x16x1_SN_LDSB0_GSU0_GSUC0_GSUWGMRR0_K1_LBSPPA512_LBSPPB1024_MIWT2_4_NLCB1_PLR0_SU0_SUM0_SUS0_SVW2_SKXCCM8_VWA2_VWB2_WGM1
    SolutionIndex: 69
    SolutionNameMin: Cijk_Ailk_Bjlk_HHS_BH_UserArgs_MT64x128x64_MI16x16x1_SN_LDSB0_GSU0_GSUC0_GSUWGMRR0_K1_LBSPPA512_LBSPPB1024_MIWT2_4_NLCB2_PLR0_SU0_SUM0_SUS0_SVW2_SKXCCM8_VWA2_VWB2_WGM1
    SolutionIndex: 70
    SolutionNameMin: Cijk_Ailk_Bjlk_HHS_BH_UserArgs_MT64x128x64_MI16x16x1_SN_LDSB0_GSU0_GSUC0_GSUWGMRR0_K1_LBSPPA512_LBSPPB1024_MIWT2_4_NLCB1_PLR0_SU0_SUM0_SUS0_SVW2_SKXCCM8_VWA2_VWB2_WGM8
    SolutionIndex: 71
    SolutionNameMin: Cijk_Ailk_Bjlk_HHS_BH_UserArgs_MT128x64x64_MI16x16x1_SN_LDSB0_GSU0_GSUC0_GSUWGMRR0_K1_LBSPPA1024_LBSPPB512_MIWT4_2_NLCB1_PLR0_SU0_SUM0_SUS0_SVW2_SKXCCM8_VWA2_VWB2_WGM1
    SolutionIndex: 72
    SolutionNameMin: Cijk_Ailk_Bjlk_HHS_BH_UserArgs_MT128x64x64_MI16x16x1_SN_LDSB0_GSU0_GSUC0_GSUWGMRR0_K1_LBSPPA1024_LBSPPB512_MIWT4_2_NLCB2_PLR0_SU0_SUM0_SUS0_SVW2_SKXCCM8_VWA2_VWB2_WGM1
    SolutionIndex: 73
    SolutionNameMin: Cijk_Ailk_Bjlk_HHS_BH_UserArgs_MT128x64x64_MI16x16x1_SN_LDSB0_GSU0_GSUC0_GSUWGMRR0_K1_LBSPPA1024_LBSPPB512_MIWT4_2_NLCB1_PLR0_SU0_SUM0_SUS0_SVW2_SKXCCM8_VWA2_VWB2_WGM8
    SolutionIndex: 74
    SolutionNameMin: Cijk_Ailk_Bjlk_HHS_BH_UserArgs_MT128x64x64_MI16x16x1_SN_LDSB0_GSU0_GSUC0_GSUWGMRR0_K1_LBSPPA1024_LBSPPB512_MIWT4_2_NLCB2_PLR0_SU0_SUM0_SUS0_SVW2_SKXCCM8_VWA2_VWB2_WGM8
    SolutionIndex: 75
    SolutionNameMin: Cijk_Ailk_Bjlk_HHS_BH_UserArgs_MT64x64x64_MI16x16x1_SN_LDSB0_GSU0_GSUC0_GSUWGMRR0_K1_LBSPPA512_LBSPPB512_MIWT2_2_NLCB1_PLR0_SU0_SUM0_SUS0_SVW2_SKXCCM8_VWA2_VWB2_WGM1
    SolutionIndex: 76
    SolutionNameMin: Cijk_Ailk_Bjlk_HHS_BH_UserArgs_MT64x64x64_MI16x16x1_SN_LDSB0_GSU0_GSUC0_GSUWGMRR0_K1_LBSPPA512_LBSPPB512_MIWT2_2_NLCB2_PLR0_SU0_SUM0_SUS0_SVW2_SKXCCM8_VWA2_VWB2_WGM1
    SolutionIndex: 77
    SolutionNameMin: Cijk_Ailk_Bjlk_HHS_BH_UserArgs_MT64x64x64_MI16x16x1_SN_LDSB0_GSU0_GSUC0_GSUWGMRR0_K1_LBSPPA512_LBSPPB512_MIWT2_2_NLCB1_PLR0_SU0_SUM0_SUS0_SVW2_SKXCCM8_VWA2_VWB2_WGM8
    SolutionIndex: 78
    SolutionNameMin: Cijk_Ailk_Bjlk_HHS_BH_UserArgs_MT64x64x64_MI16x16x1_SN_LDSB0_GSU0_GSUC0_GSUWGMRR0_K1_LBSPPA512_LBSPPB512_MIWT2_2_NLCB2_PLR0_SU0_SUM0_SUS0_SVW2_SKXCCM8_VWA2_VWB2_WGM8
    SolutionIndex: 79
    SolutionNameMin: Cijk_Ailk_Bjlk_HHS_BH_UserArgs_MT128x128x64_MI16x16x1_SN_LDSB0_GSU0_GSUC0_GSUWGMRR0_K1_LBSPPA1024_LBSPPB1024_MIWT4_4_NLCB1_PLR0_SU0_SUM0_SUS0_SVW4_SKXCCM0_VWA4_VWB4_WGM1
    SolutionIndex: 80
    SolutionNameMin: Cijk_Ailk_Bjlk_HHS_BH_UserArgs_MT128x128x64_MI16x16x1_SN_LDSB0_GSU0_GSUC0_GSUWGMRR0_K1_LBSPPA1024_LBSPPB1024_MIWT4_4_NLCB2_PLR0_SU0_SUM0_SUS0_SVW4_SKXCCM0_VWA4_VWB4_WGM1
    SolutionIndex: 81
    SolutionNameMin: Cijk_Ailk_Bjlk_HHS_BH_UserArgs_MT128x128x64_MI16x16x1_SN_LDSB0_GSU0_GSUC0_GSUWGMRR0_K1_LBSPPA1024_LBSPPB1024_MIWT4_4_NLCB1_PLR0_SU0_SUM0_SUS0_SVW4_SKXCCM0_VWA4_VWB4_WGM8
    SolutionIndex: 82
    SolutionNameMin: Cijk_Ailk_Bjlk_HHS_BH_UserArgs_MT128x128x64_MI16x16x1_SN_LDSB0_GSU0_GSUC0_GSUWGMRR0_K1_LBSPPA1024_LBSPPB1024_MIWT4_4_NLCB2_PLR0_SU0_SUM0_SUS0_SVW4_SKXCCM0_VWA4_VWB4_WGM8
    SolutionIndex: 83
    SolutionNameMin: Cijk_Ailk_Bjlk_HHS_BH_UserArgs_MT128x128x64_MI16x16x1_SN_LDSB0_GSU0_GSUC0_GSUWGMRR0_K1_LBSPPA1024_LBSPPB1024_MIWT4_4_NLCB1_PLR0_SU0_SUM0_SUS0_SVW4_SKXCCM8_VWA4_VWB4_WGM1
    SolutionIndex: 84
    SolutionNameMin: Cijk_Ailk_Bjlk_HHS_BH_UserArgs_MT128x128x64_MI16x16x1_SN_LDSB0_GSU0_GSUC0_GSUWGMRR0_K1_LBSPPA1024_LBSPPB1024_MIWT4_4_NLCB2_PLR0_SU0_SUM0_SUS0_SVW4_SKXCCM8_VWA4_VWB4_WGM1
    SolutionIndex: 85
    SolutionNameMin: Cijk_Ailk_Bjlk_HHS_BH_UserArgs_MT128x128x64_MI16x16x1_SN_LDSB0_GSU0_GSUC0_GSUWGMRR0_K1_LBSPPA1024_LBSPPB1024_MIWT4_4_NLCB1_PLR0_SU0_SUM0_SUS0_SVW4_SKXCCM8_VWA4_VWB4_WGM8
    SolutionIndex: 86
    SolutionNameMin: Cijk_Ailk_Bjlk_HHS_BH_UserArgs_MT128x128x64_MI16x16x1_SN_LDSB0_GSU0_GSUC0_GSUWGMRR0_K1_LBSPPA1024_LBSPPB1024_MIWT4_4_NLCB2_PLR0_SU0_SUM0_SUS0_SVW4_SKXCCM8_VWA4_VWB4_WGM8
- - - [128, 128, 1, 128, 128, 128, 128, 128]
    - [54, 0.05]
  - - [128, 128, 1, 256, 128, 128, 128, 128]
    - [54, 0.083]
  - - [128, 128, 1, 512, 128, 128, 128, 128]
    - [59, 0.118]
  - - [128, 128, 1, 1024, 128, 128, 128, 128]
    - [59, 0.142]
  - - [128, 128, 1, 2048, 128, 128, 128, 128]
    - [59, 0.171]
  - - [128, 128, 1, 4096, 128, 128, 128, 128]
    - [59, 0.42]
  - - [128, 128, 1, 8192, 128, 128, 128, 128]
    - [59, 0.811]
  - - [128, 256, 1, 128, 128, 128, 128, 256]
    - [54, 0.102]
  - - [128, 256, 1, 256, 128, 128, 128, 256]
    - [59, 0.156]
  - - [128, 256, 1, 512, 128, 128, 128, 256]
    - [59, 0.229]
  - - [128, 256, 1, 1024, 128, 128, 128, 256]
    - [59, 0.294]
  - - [128, 256, 1, 2048, 128, 128, 128, 256]
    - [54, 0.625]
  - - [128, 256, 1, 4096, 128, 128, 128, 256]
    - [54, 1.199]
  - - [128, 256, 1, 8192, 128, 128, 128, 256]
    - [59, 2.032]
  - - [128, 512, 1, 128, 128, 128, 128, 512]
    - [54, 0.193]
  - - [128, 512, 1, 256, 128, 128, 128, 512]
    - [59, 0.307]
  - - [128, 512, 1, 512, 128, 128, 128, 512]
    - [59, 0.477]
  - - [128, 512, 1, 1024, 128, 128, 128, 512]
    - [59, 0.918]
  - - [128, 512, 1, 2048, 128, 128, 128, 512]
    - [59, 1.581]
  - - [128, 512, 1, 4096, 128, 128, 128, 512]
    - [59, 2.455]
  - - [128, 512, 1, 8192, 128, 128, 128, 512]
    - [59, 3.538]
  - - [128, 1024, 1, 128, 128, 128, 128, 1024]
    - [59, 0.379]
  - - [128, 1024, 1, 256, 128, 128, 128, 1024]
    - [59, 0.642]
  - - [128, 1024, 1, 512, 128, 128, 128, 1024]
    - [59, 1.073]
  - - [128, 1024, 1, 1024, 128, 128, 128, 1024]
    - [54, 1.793]
  - - [128, 1024, 1, 2048, 128, 128, 128, 1024]
    - [59, 2.79]
  - - [128, 1024, 1, 4096, 128, 128, 128, 1024]
    - [53, 4.011]
  - - [128, 1024, 1, 8192, 128, 128, 128, 1024]
    - [49, 5.421]
  - - [128, 2048, 1, 128, 128, 128, 128, 2048]
    - [59, 0.752]
  - - [128, 2048, 1, 256, 128, 128, 128, 2048]
    - [54, 1.241]
  - - [128, 2048, 1, 512, 128, 128, 128, 2048]
    - [59, 1.999]
  - - [128, 2048, 1, 1024, 128, 128, 128, 2048]
    - [56, 3.013]
  - - [128, 2048, 1, 2048, 128, 128, 128, 2048]
    - [77, 4.702]
  - - [128, 2048, 1, 4096, 128, 128, 128, 2048]
    - [77, 6.675]
  - - [128, 2048, 1, 8192, 128, 128, 128, 2048]
    - [78, 9.028]
  - - [128, 4096, 1, 128, 128, 128, 128, 4096]
    - [52, 1.458]
  - - [128, 4096, 1, 256, 128, 128, 128, 4096]
    - [58, 2.257]
  - - [128, 4096, 1, 512, 128, 128, 128, 4096]
    - [56, 3.358]
  - - [128, 4096, 1, 1024, 128, 128, 128, 4096]
    - [67, 5.327]
  - - [128, 4096, 1, 2048, 128, 128, 128, 4096]
    - [22, 7.943]
  - - [128, 4096, 1, 4096, 128, 128, 128, 4096]
    - [78, 10.217]
  - - [128, 4096, 1, 8192, 128, 128, 128, 4096]
    - [64, 13.009]
  - - [128, 8192, 1, 128, 128, 128, 128, 8192]
    - [67, 2.579]
  - - [128, 8192, 1, 256, 128, 128, 128, 8192]
    - [75, 3.986]
  - - [128, 8192, 1, 512, 128, 128, 128, 8192]
    - [75, 6.277]
  - - [128, 8192, 1, 1024, 128, 128, 128, 8192]
    - [75, 8.651]
  - - [128, 8192, 1, 2048, 128, 128, 128, 8192]
    - [76, 10.991]
  - - [128, 8192, 1, 4096, 128, 128, 128, 8192]
    - [45, 14.123]
  - - [128, 8192, 1, 8192, 128, 128, 128, 8192]
    - [80, 18.862]
  - - [256, 128, 1, 128, 256, 256, 256, 128]
    - [54, 0.099]
  - - [256, 128, 1, 256, 256, 256, 256, 128]
    - [59, 0.158]
  - - [256, 128, 1, 512, 256, 256, 256, 128]
    - [59, 0.23]
  - - [256, 128, 1, 1024, 256, 256, 256, 128]
    - [59, 0.3]
  - - [256, 128, 1, 2048, 256, 256, 256, 128]
    - [59, 0.636]
  - - [256, 128, 1, 4096, 256, 256, 256, 128]
    - [59, 1.198]
  - - [256, 128, 1, 8192, 256, 256, 256, 128]
    - [59, 2.003]
  - - [256, 256, 1, 128, 256, 256, 256, 256]
    - [54, 0.2]
  - - [256, 256, 1, 256, 256, 256, 256, 256]
    - [59, 0.314]
  - - [256, 256, 1, 512, 256, 256, 256, 256]
    - [59, 0.471]
  - - [256, 256, 1, 1024, 256, 256, 256, 256]
    - [54, 0.916]
  - - [256, 256, 1, 2048, 256, 256, 256, 256]
    - [54, 1.558]
  - - [256, 256, 1, 4096, 256, 256, 256, 256]
    - [59, 2.514]
  - - [256, 256, 1, 8192, 256, 256, 256, 256]
    - [59, 3.517]
  - - [256, 512, 1, 128, 256, 256, 256, 512]
    - [54, 0.379]
  - - [256, 512, 1, 256, 256, 256, 256, 512]
    - [59, 0.641]
  - - [256, 512, 1, 512, 256, 256, 256, 512]
    - [59, 1.079]
  - - [256, 512, 1, 1024, 256, 256, 256, 512]
    - [59, 1.797]
  - - [256, 512, 1, 2048, 256, 256, 256, 512]
    - [54, 2.868]
  - - [256, 512, 1, 4096, 256, 256, 256, 512]
    - [57, 4.009]
  - - [256, 512, 1, 8192, 256, 256, 256, 512]
    - [58, 5.554]
  - - [256, 1024, 1, 128, 256, 256, 256, 1024]
    - [59, 0.755]
  - - [256, 1024, 1, 256, 256, 256, 256, 1024]
    - [54, 1.265]
  - - [256, 1024, 1, 512, 256, 256, 256, 1024]
    - [54, 2.022]
  - - [256, 1024, 1, 1024, 256, 256, 256, 1024]
    - [54, 3.105]
  - - [256, 1024, 1, 2048, 256, 256, 256, 1024]
    - [77, 4.653]
  - - [256, 1024, 1, 4096, 256, 256, 256, 1024]
    - [19, 6.722]
  - - [256, 1024, 1, 8192, 256, 256, 256, 1024]
    - [77, 8.948]
  - - [256, 2048, 1, 128, 256, 256, 256, 2048]
    - [52, 1.443]
  - - [256, 2048, 1, 256, 256, 256, 256, 2048]
    - [58, 2.207]
  - - [256, 2048, 1, 512, 256, 256, 256, 2048]
    - [56, 3.416]
  - - [256, 2048, 1, 1024, 256, 256, 256, 2048]
    - [76, 5.352]
  - - [256, 2048, 1, 2048, 256, 256, 256, 2048]
    - [22, 7.976]
  - - [256, 2048, 1, 4096, 256, 256, 256, 2048]
    - [77, 10.221]
  - - [256, 2048, 1, 8192, 256, 256, 256, 2048]
    - [72, 12.758]
  - - [256, 4096, 1, 128, 256, 256, 256, 4096]
    - [67, 2.563]
  - - [256, 4096, 1, 256, 256, 256, 256, 4096]
    - [75, 4.001]
  - - [256, 4096, 1, 512, 256, 256, 256, 4096]
    - [75, 6.245]
  - - [256, 4096, 1, 1024, 256, 256, 256, 4096]
    - [76, 9.39]
  - - [256, 4096, 1, 2048, 256, 256, 256, 4096]
    - [73, 11.27]
  - - [256, 4096, 1, 4096, 256, 256, 256, 4096]
    - [74, 14.334]
  - - [256, 4096, 1, 8192, 256, 256, 256, 4096]
    - [46, 18.879]
  - - [256, 8192, 1, 128, 256, 256, 256, 8192]
    - [64, 3.933]
  - - [256, 8192, 1, 256, 256, 256, 256, 8192]
    - [62, 5.728]
  - - [256, 8192, 1, 512, 256, 256, 256, 8192]
    - [76, 8.663]
  - - [256, 8192, 1, 1024, 256, 256, 256, 8192]
    - [68, 11.803]
  - - [256, 8192, 1, 2048, 256, 256, 256, 8192]
    - [46, 15.619]
  - - [256, 8192, 1, 4096, 256, 256, 256, 8192]
    - [85, 20.193]
  - - [256, 8192, 1, 8192, 256, 256, 256, 8192]
    - [79, 21.625]
  - - [512, 128, 1, 128, 512, 512, 512, 128]
    - [54, 0.199]
  - - [512, 128, 1, 256, 512, 512, 512, 128]
    - [59, 0.315]
  - - [512, 128, 1, 512, 512, 512, 512, 128]
    - [59, 0.473]
  - - [512, 128, 1, 1024, 512, 512, 512, 128]
    - [59, 0.912]
  - - [512, 128, 1, 2048, 512, 512, 512, 128]
    - [54, 1.569]
  - - [512, 128, 1, 4096, 512, 512, 512, 128]
    - [59, 2.472]
  - - [512, 128, 1, 8192, 512, 512, 512, 128]
    - [60, 3.498]
  - - [512, 256, 1, 128, 512, 512, 512, 256]
    - [59, 0.38]
  - - [512, 256, 1, 256, 512, 512, 512, 256]
    - [59, 0.641]
  - - [512, 256, 1, 512, 512, 512, 512, 256]
    - [59, 1.054]
  - - [512, 256, 1, 1024, 512, 512, 512, 256]
    - [54, 1.789]
  - - [512, 256, 1, 2048, 512, 512, 512, 256]
    - [59, 2.863]
  - - [512, 256, 1, 4096, 512, 512, 512, 256]
    - [56, 4.076]
  - - [512, 256, 1, 8192, 512, 512, 512, 256]
    - [56, 5.572]
  - - [512, 512, 1, 128, 512, 512, 512, 512]
    - [54, 0.782]
  - - [512, 512, 1, 256, 512, 512, 512, 512]
    - [59, 1.254]
  - - [512, 512, 1, 512, 512, 512, 512, 512]
    - [54, 2.021]
  - - [512, 512, 1, 1024, 512, 512, 512, 512]
    - [59, 3.047]
  - - [512, 512, 1, 2048, 512, 512, 512, 512]
    - [52, 4.599]
  - - [512, 512, 1, 4096, 512, 512, 512, 512]
    - [21, 6.756]
  - - [512, 512, 1, 8192, 512, 512, 512, 512]
    - [75, 8.761]
  - - [512, 1024, 1, 128, 512, 512, 512, 1024]
    - [52, 1.43]
  - - [512, 1024, 1, 256, 512, 512, 512, 1024]
    - [58, 2.261]
  - - [512, 1024, 1, 512, 512, 512, 512, 1024]
    - [58, 3.422]
  - - [512, 1024, 1, 1024, 512, 512, 512, 1024]
    - [19, 5.5]
  - - [512, 1024, 1, 2048, 512, 512, 512, 1024]
    - [21, 8.092]
  - - [512, 1024, 1, 4096, 512, 512, 512, 1024]
    - [77, 9.973]
  - - [512, 1024, 1, 8192, 512, 512, 512, 1024]
    - [71, 12.224]
  - - [512, 2048, 1, 128, 512, 512, 512, 2048]
    - [67, 2.574]
  - - [512, 2048, 1, 256, 512, 512, 512, 2048]
    - [75, 4.074]
  - - [512, 2048, 1, 512, 512, 512, 512, 2048]
    - [75, 6.304]
  - - [512, 2048, 1, 1024, 512, 512, 512, 2048]
    - [75, 9.463]
  - - [512, 2048, 1, 2048, 512, 512, 512, 2048]
    - [78, 11.006]
  - - [512, 2048, 1, 4096, 512, 512, 512, 2048]
    - [74, 13.629]
  - - [512, 2048, 1, 8192, 512, 512, 512, 2048]
    - [48, 18.428]
  - - [512, 4096, 1, 128, 512, 512, 512, 4096]
    - [65, 3.94]
  - - [512, 4096, 1, 256, 512, 512, 512, 4096]
    - [61, 5.701]
  - - [512, 4096, 1, 512, 512, 512, 512, 4096]
    - [75, 8.911]
  - - [512, 4096, 1, 1024, 512, 512, 512, 4096]
    - [72, 12.019]
  - - [512, 4096, 1, 2048, 512, 512, 512, 4096]
    - [45, 15.092]
  - - [512, 4096, 1, 4096, 512, 512, 512, 4096]
    - [46, 19.508]
  - - [512, 4096, 1, 8192, 512, 512, 512, 4096]
    - [29, 21.233]
  - - [512, 8192, 1, 128, 512, 512, 512, 8192]
    - [79, 5.923]
  - - [512, 8192, 1, 256, 512, 512, 512, 8192]
    - [79, 8.016]
  - - [512, 8192, 1, 512, 512, 512, 512, 8192]
    - [74, 11.526]
  - - [512, 8192, 1, 1024, 512, 512, 512, 8192]
    - [83, 16.197]
  - - [512, 8192, 1, 2048, 512, 512, 512, 8192]
    - [86, 19.936]
  - - [512, 8192, 1, 4096, 512, 512, 512, 8192]
    - [29, 22.031]
  - - [512, 8192, 1, 8192, 512, 512, 512, 8192]
    - [30, 25.29]
  - - [1024, 128, 1, 128, 1024, 1024, 1024, 128]
    - [59, 0.371]
  - - [1024, 128, 1, 256, 1024, 1024, 1024, 128]
    - [59, 0.636]
  - - [1024, 128, 1, 512, 1024, 1024, 1024, 128]
    - [59, 1.062]
  - - [1024, 128, 1, 1024, 1024, 1024, 1024, 128]
    - [54, 1.83]
  - - [1024, 128, 1, 2048, 1024, 1024, 1024, 128]
    - [60, 2.741]
  - - [1024, 128, 1, 4096, 1024, 1024, 1024, 128]
    - [50, 4.007]
  - - [1024, 128, 1, 8192, 1024, 1024, 1024, 128]
    - [19, 5.728]
  - - [1024, 256, 1, 128, 1024, 1024, 1024, 256]
    - [54, 0.781]
  - - [1024, 256, 1, 256, 1024, 1024, 1024, 256]
    - [54, 1.257]
  - - [1024, 256, 1, 512, 1024, 1024, 1024, 256]
    - [59, 1.998]
  - - [1024, 256, 1, 1024, 1024, 1024, 1024, 256]
    - [59, 3.111]
  - - [1024, 256, 1, 2048, 1024, 1024, 1024, 256]
    - [75, 4.686]
  - - [1024, 256, 1, 4096, 1024, 1024, 1024, 256]
    - [19, 6.842]
  - - [1024, 256, 1, 8192, 1024, 1024, 1024, 256]
    - [76, 9.175]
  - - [1024, 512, 1, 128, 1024, 1024, 1024, 512]
    - [52, 1.438]
  - - [1024, 512, 1, 256, 1024, 1024, 1024, 512]
    - [58, 2.265]
  - - [1024, 512, 1, 512, 1024, 1024, 1024, 512]
    - [58, 3.425]
  - - [1024, 512, 1, 1024, 1024, 1024, 1024, 512]
    - [19, 5.319]
  - - [1024, 512, 1, 2048, 1024, 1024, 1024, 512]
    - [22, 8.019]
  - - [1024, 512, 1, 4096, 1024, 1024, 1024, 512]
    - [76, 10.026]
  - - [1024, 512, 1, 8192, 1024, 1024, 1024, 512]
    - [70, 12.323]
  - - [1024, 1024, 1, 128, 1024, 1024, 1024, 1024]
    - [66, 2.583]
  - - [1024, 1024, 1, 256, 1024, 1024, 1024, 1024]
    - [75, 4.165]
  - - [1024, 1024, 1, 512, 1024, 1024, 1024, 1024]
    - [75, 6.298]
  - - [1024, 1024, 1, 1024, 1024, 1024, 1024, 1024]
    - [75, 9.511]
  - - [1024, 1024, 1, 2048, 1024, 1024, 1024, 1024]
    - [71, 10.757]
  - - [1024, 1024, 1, 4096, 1024, 1024, 1024, 1024]
    - [46, 13.287]
  - - [1024, 1024, 1, 8192, 1024, 1024, 1024, 1024]
    - [45, 17.785]
  - - [1024, 2048, 1, 128, 1024, 1024, 1024, 2048]
    - [65, 4.003]
  - - [1024, 2048, 1, 256, 1024, 1024, 1024, 2048]
    - [75, 5.681]
  - - [1024, 2048, 1, 512, 1024, 1024, 1024, 2048]
    - [75, 8.872]
  - - [1024, 2048, 1, 1024, 1024, 1024, 1024, 2048]
    - [68, 11.922]
  - - [1024, 2048, 1, 2048, 1024, 1024, 1024, 2048]
    - [46, 14.999]
  - - [1024, 2048, 1, 4096, 1024, 1024, 1024, 2048]
    - [45, 19.141]
  - - [1024, 2048, 1, 8192, 1024, 1024, 1024, 2048]
    - [41, 21.261]
  - - [1024, 4096, 1, 128, 1024, 1024, 1024, 4096]
    - [81, 5.978]
  - - [1024, 4096, 1, 256, 1024, 1024, 1024, 4096]
    - [80, 8.105]
  - - [1024, 4096, 1, 512, 1024, 1024, 1024, 4096]
    - [83, 11.578]
  - - [1024, 4096, 1, 1024, 1024, 1024, 1024, 4096]
    - [83, 15.893]
  - - [1024, 4096, 1, 2048, 1024, 1024, 1024, 4096]
    - [46, 19.683]
  - - [1024, 4096, 1, 4096, 1024, 1024, 1024, 4096]
    - [39, 22.043]
  - - [1024, 4096, 1, 8192, 1024, 1024, 1024, 4096]
    - [2, 24.894]
  - - [1024, 8192, 1, 128, 1024, 1024, 1024, 8192]
    - [81, 7.854]
  - - [1024, 8192, 1, 256, 1024, 1024, 1024, 8192]
    - [74, 10.093]
  - - [1024, 8192, 1, 512, 1024, 1024, 1024, 8192]
    - [48, 15.562]
  - - [1024, 8192, 1, 1024, 1024, 1024, 1024, 8192]
    - [85, 19.832]
  - - [1024, 8192, 1, 2048, 1024, 1024, 1024, 8192]
    - [40, 21.953]
  - - [1024, 8192, 1, 4096, 1024, 1024, 1024, 8192]
    - [35, 25.39]
  - - [1024, 8192, 1, 8192, 1024, 1024, 1024, 8192]
    - [24, 29.555]
  - - [2048, 128, 1, 128, 2048, 2048, 2048, 128]
    - [54, 0.756]
  - - [2048, 128, 1, 256, 2048, 2048, 2048, 128]
    - [59, 1.26]
  - - [2048, 128, 1, 512, 2048, 2048, 2048, 128]
    - [54, 2.021]
  - - [2048, 128, 1, 1024, 2048, 2048, 2048, 128]
    - [51, 3.025]
  - - [2048, 128, 1, 2048, 2048, 2048, 2048, 128]
    - [76, 4.659]
  - - [2048, 128, 1, 4096, 2048, 2048, 2048, 128]
    - [19, 7.357]
  - - [2048, 128, 1, 8192, 2048, 2048, 2048, 128]
    - [76, 9.149]
  - - [2048, 256, 1, 128, 2048, 2048, 2048, 256]
    - [52, 1.438]
  - - [2048, 256, 1, 256, 2048, 2048, 2048, 256]
    - [58, 2.26]
  - - [2048, 256, 1, 512, 2048, 2048, 2048, 256]
    - [58, 3.403]
  - - [2048, 256, 1, 1024, 2048, 2048, 2048, 256]
    - [19, 5.428]
  - - [2048, 256, 1, 2048, 2048, 2048, 2048, 256]
    - [19, 8.001]
  - - [2048, 256, 1, 4096, 2048, 2048, 2048, 256]
    - [76, 10.122]
  - - [2048, 256, 1, 8192, 2048, 2048, 2048, 256]
    - [68, 12.527]
  - - [2048, 512, 1, 128, 2048, 2048, 2048, 512]
    - [66, 2.606]
  - - [2048, 512, 1, 256, 2048, 2048, 2048, 512]
    - [75, 4.167]
  - - [2048, 512, 1, 512, 2048, 2048, 2048, 512]
    - [75, 6.343]
  - - [2048, 512, 1, 1024, 2048, 2048, 2048, 512]
    - [78, 9.129]
  - - [2048, 512, 1, 2048, 2048, 2048, 2048, 512]
    - [17, 10.85]
  - - [2048, 512, 1, 4096, 2048, 2048, 2048, 512]
    - [45, 13.823]
  - - [2048, 512, 1, 8192, 2048, 2048, 2048, 512]
    - [47, 18.119]
  - - [2048, 1024, 1, 128, 2048, 2048, 2048, 1024]
    - [66, 4.005]
  - - [2048, 1024, 1, 256, 2048, 2048, 2048, 1024]
    - [75, 5.715]
  - - [2048, 1024, 1, 512, 2048, 2048, 2048, 1024]
    - [76, 8.662]
  - - [2048, 1024, 1, 1024, 2048, 2048, 2048, 1024]
    - [74, 11.721]
  - - [2048, 1024, 1, 2048, 2048, 2048, 2048, 1024]
    - [47, 15.026]
  - - [2048, 1024, 1, 4096, 2048, 2048, 2048, 1024]
    - [86, 19.152]
  - - [2048, 1024, 1, 8192, 2048, 2048, 2048, 1024]
    - [28, 20.972]
  - - [2048, 2048, 1, 128, 2048, 2048, 2048, 2048]
    - [81, 5.963]
  - - [2048, 2048, 1, 256, 2048, 2048, 2048, 2048]
    - [81, 8.008]
  - - [2048, 2048, 1, 512, 2048, 2048, 2048, 2048]
    - [71, 11.466]
  - - [2048, 2048, 1, 1024, 2048, 2048, 2048, 2048]
    - [86, 15.77]
  - - [2048, 2048, 1, 2048, 2048, 2048, 2048, 2048]
    - [45, 19.731]
  - - [2048, 2048, 1, 4096, 2048, 2048, 2048, 2048]
    - [14, 21.769]
  - - [2048, 2048, 1, 8192, 2048, 2048, 2048, 2048]
    - [36, 24.749]
  - - [2048, 4096, 1, 128, 2048, 2048, 2048, 4096]
    - [82, 7.945]
  - - [2048, 4096, 1, 256, 2048, 2048, 2048, 4096]
    - [65, 10.172]
  - - [2048, 4096, 1, 512, 2048, 2048, 2048, 4096]
    - [83, 15.326]
  - - [2048, 4096, 1, 1024, 2048, 2048, 2048, 4096]
    - [47, 19.726]
  - - [2048, 4096, 1, 2048, 2048, 2048, 2048, 4096]
    - [13, 21.706]
  - - [2048, 4096, 1, 4096, 2048, 2048, 2048, 4096]
    - [35, 25.491]
  - - [2048, 4096, 1, 8192, 2048, 2048, 2048, 4096]
    - [36, 29.528]
  - - [2048, 8192, 1, 128, 2048, 2048, 2048, 8192]
    - [83, 9.321]
  - - [2048, 8192, 1, 256, 2048, 2048, 2048, 8192]
    - [84, 13.747]
  - - [2048, 8192, 1, 512, 2048, 2048, 2048, 8192]
    - [45, 18.125]
  - - [2048, 8192, 1, 1024, 2048, 2048, 2048, 8192]
    - [37, 21.812]
  - - [2048, 8192, 1, 2048, 2048, 2048, 2048, 8192]
    - [34, 25.08]
  - - [2048, 8192, 1, 4096, 2048, 2048, 2048, 8192]
    - [34, 29.149]
  - - [2048, 8192, 1, 8192, 2048, 2048, 2048, 8192]
    - [9, 31.999]
  - - [4096, 128, 1, 128, 4096, 4096, 4096, 128]
    - [56, 1.445]
  - - [4096, 128, 1, 256, 4096, 4096, 4096, 128]
    - [56, 2.269]
  - - [4096, 128, 1, 512, 4096, 4096, 4096, 128]
    - [56, 3.294]
  - - [4096, 128, 1, 1024, 4096, 4096, 4096, 128]
    - [67, 5.417]
  - - [4096, 128, 1, 2048, 4096, 4096, 4096, 128]
    - [19, 8.143]
  - - [4096, 128, 1, 4096, 4096, 4096, 4096, 128]
    - [69, 10.068]
  - - [4096, 128, 1, 8192, 4096, 4096, 4096, 128]
    - [63, 12.786]
  - - [4096, 256, 1, 128, 4096, 4096, 4096, 256]
    - [66, 2.594]
  - - [4096, 256, 1, 256, 4096, 4096, 4096, 256]
    - [75, 4.212]
  - - [4096, 256, 1, 512, 4096, 4096, 4096, 256]
    - [76, 6.278]
  - - [4096, 256, 1, 1024, 4096, 4096, 4096, 256]
    - [77, 9.293]
  - - [4096, 256, 1, 2048, 4096, 4096, 4096, 256]
    - [16, 10.816]
  - - [4096, 256, 1, 4096, 4096, 4096, 4096, 256]
    - [69, 14.102]
  - - [4096, 256, 1, 8192, 4096, 4096, 4096, 256]
    - [46, 18.218]
  - - [4096, 512, 1, 128, 4096, 4096, 4096, 512]
    - [66, 4.031]
  - - [4096, 512, 1, 256, 4096, 4096, 4096, 512]
    - [65, 5.816]
  - - [4096, 512, 1, 512, 4096, 4096, 4096, 512]
    - [78, 8.728]
  - - [4096, 512, 1, 1024, 4096, 4096, 4096, 512]
    - [73, 11.761]
  - - [4096, 512, 1, 2048, 4096, 4096, 4096, 512]
    - [46, 15.139]
  - - [4096, 512, 1, 4096, 4096, 4096, 4096, 512]
    - [84, 19.237]
  - - [4096, 512, 1, 8192, 4096, 4096, 4096, 512]
    - [7, 21.237]
  - - [4096, 1024, 1, 128, 4096, 4096, 4096, 1024]
    - [82, 5.871]
  - - [4096, 1024, 1, 256, 4096, 4096, 4096, 1024]
    - [84, 8.067]
  - - [4096, 1024, 1, 512, 4096, 4096, 4096, 1024]
    - [20, 11.305]
  - - [4096, 1024, 1, 1024, 4096, 4096, 4096, 1024]
    - [86, 15.515]
  - - [4096, 1024, 1, 2048, 4096, 4096, 4096, 1024]
    - [47, 19.491]
  - - [4096, 1024, 1, 4096, 4096, 4096, 4096, 1024]
    - [39, 22.218]
  - - [4096, 1024, 1, 8192, 4096, 4096, 4096, 1024]
    - [6, 24.757]
  - - [4096, 2048, 1, 128, 4096, 4096, 4096, 2048]
    - [81, 7.883]
  - - [4096, 2048, 1, 256, 4096, 4096, 4096, 2048]
    - [71, 10.3]
  - - [4096, 2048, 1, 512, 4096, 4096, 4096, 2048]
    - [85, 15.48]
  - - [4096, 2048, 1, 1024, 4096, 4096, 4096, 2048]
    - [45, 19.94]
  - - [4096, 2048, 1, 2048, 4096, 4096, 4096, 2048]
    - [42, 21.589]
  - - [4096, 2048, 1, 4096, 4096, 4096, 4096, 2048]
    - [36, 25.189]
  - - [4096, 2048, 1, 8192, 4096, 4096, 4096, 2048]
    - [11, 29.33]
  - - [4096, 4096, 1, 128, 4096, 4096, 4096, 4096]
    - [82, 9.412]
  - - [4096, 4096, 1, 256, 4096, 4096, 4096, 4096]
    - [83, 13.457]
  - - [4096, 4096, 1, 512, 4096, 4096, 4096, 4096]
    - [43, 18.682]
  - - [4096, 4096, 1, 1024, 4096, 4096, 4096, 4096]
    - [37, 22.527]
  - - [4096, 4096, 1, 2048, 4096, 4096, 4096, 4096]
    - [10, 25.295]
  - - [4096, 4096, 1, 4096, 4096, 4096, 4096, 4096]
    - [4, 29.055]
  - - [4096, 4096, 1, 8192, 4096, 4096, 4096, 4096]
    - [3, 32.032]
  - - [4096, 8192, 1, 128, 4096, 4096, 4096, 8192]
    - [82, 10.758]
  - - [4096, 8192, 1, 256, 4096, 4096, 4096, 8192]
    - [46, 14.665]
  - - [4096, 8192, 1, 512, 4096, 4096, 4096, 8192]
    - [15, 19.436]
  - - [4096, 8192, 1, 1024, 4096, 4096, 4096, 8192]
    - [34, 25.154]
  - - [4096, 8192, 1, 2048, 4096, 4096, 4096, 8192]
    - [33, 28.806]
  - - [4096, 8192, 1, 4096, 4096, 4096, 4096, 8192]
    - [12, 31.516]
  - - [4096, 8192, 1, 8192, 4096, 4096, 4096, 8192]
    - [33, 32.605]
  - - [8192, 128, 1, 128, 8192, 8192, 8192, 128]
    - [66, 2.598]
  - - [8192, 128, 1, 256, 8192, 8192, 8192, 128]
    - [75, 3.693]
  - - [8192, 128, 1, 512, 8192, 8192, 8192, 128]
    - [77, 6.24]
  - - [8192, 128, 1, 1024, 8192, 8192, 8192, 128]
    - [77, 8.721]
  - - [8192, 128, 1, 2048, 8192, 8192, 8192, 128]
    - [18, 11.054]
  - - [8192, 128, 1, 4096, 8192, 8192, 8192, 128]
    - [45, 14.485]
  - - [8192, 128, 1, 8192, 8192, 8192, 8192, 128]
    - [32, 18.855]
  - - [8192, 256, 1, 128, 8192, 8192, 8192, 256]
    - [66, 4.056]
  - - [8192, 256, 1, 256, 8192, 8192, 8192, 256]
    - [55, 5.602]
  - - [8192, 256, 1, 512, 8192, 8192, 8192, 256]
    - [77, 8.538]
  - - [8192, 256, 1, 1024, 8192, 8192, 8192, 256]
    - [74, 11.682]
  - - [8192, 256, 1, 2048, 8192, 8192, 8192, 256]
    - [31, 15.618]
  - - [8192, 256, 1, 4096, 8192, 8192, 8192, 256]
    - [84, 19.611]
  - - [8192, 256, 1, 8192, 8192, 8192, 8192, 256]
    - [27, 21.694]
  - - [8192, 512, 1, 128, 8192, 8192, 8192, 512]
    - [82, 5.892]
  - - [8192, 512, 1, 256, 8192, 8192, 8192, 512]
    - [81, 7.879]
  - - [8192, 512, 1, 512, 8192, 8192, 8192, 512]
    - [70, 11.453]
  - - [8192, 512, 1, 1024, 8192, 8192, 8192, 512]
    - [86, 15.982]
  - - [8192, 512, 1, 2048, 8192, 8192, 8192, 512]
    - [84, 19.815]
  - - [8192, 512, 1, 4096, 8192, 8192, 8192, 512]
    - [26, 22.559]
  - - [8192, 512, 1, 8192, 8192, 8192, 8192, 512]
    - [25, 25.442]
  - - [8192, 1024, 1, 128, 8192, 8192, 8192, 1024]
    - [79, 7.524]
  - - [8192, 1024, 1, 256, 8192, 8192, 8192, 1024]
    - [70, 10.109]
  - - [8192, 1024, 1, 512, 8192, 8192, 8192, 1024]
    - [48, 15.51]
  - - [8192, 1024, 1, 1024, 8192, 8192, 8192, 1024]
    - [86, 19.852]
  - - [8192, 1024, 1, 2048, 8192, 8192, 8192, 1024]
    - [26, 21.936]
  - - [8192, 1024, 1, 4096, 8192, 8192, 8192, 1024]
    - [36, 25.704]
  - - [8192, 1024, 1, 8192, 8192, 8192, 8192, 1024]
    - [23, 29.435]
  - - [8192, 2048, 1, 128, 8192, 8192, 8192, 2048]
    - [85, 8.96]
  - - [8192, 2048, 1, 256, 8192, 8192, 8192, 2048]
    - [86, 13.521]
  - - [8192, 2048, 1, 512, 8192, 8192, 8192, 2048]
    - [40, 18.19]
  - - [8192, 2048, 1, 1024, 8192, 8192, 8192, 2048]
    - [38, 21.826]
  - - [8192, 2048, 1, 2048, 8192, 8192, 8192, 2048]
    - [10, 24.781]
  - - [8192, 2048, 1, 4096, 8192, 8192, 8192, 2048]
    - [0, 28.952]
  - - [8192, 2048, 1, 8192, 8192, 8192, 8192, 2048]
    - [5, 31.941]
  - - [8192, 4096, 1, 128, 8192, 8192, 8192, 4096]
    - [79, 10.332]
  - - [8192, 4096, 1, 256, 8192, 8192, 8192, 4096]
    - [48, 14.34]
  - - [8192, 4096, 1, 512, 8192, 8192, 8192, 4096]
    - [8, 19.668]
  - - [8192, 4096, 1, 1024, 8192, 8192, 8192, 4096]
    - [3, 25.223]
  - - [8192, 4096, 1, 2048, 8192, 8192, 8192, 4096]
    - [33, 28.998]
  - - [8192, 4096, 1, 4096, 8192, 8192, 8192, 4096]
    - [10, 31.589]
  - - [8192, 4096, 1, 8192, 8192, 8192, 8192, 4096]
    - [36, 32.816]
  - - [8192, 8192, 1, 128, 8192, 8192, 8192, 8192]
    - [32, 10.794]
  - - [8192, 8192, 1, 256, 8192, 8192, 8192, 8192]
    - [44, 16.291]
  - - [8192, 8192, 1, 512, 8192, 8192, 8192, 8192]
    - [26, 22.167]
  - - [8192, 8192, 1, 1024, 8192, 8192, 8192, 8192]
    - [1, 28.025]
  - - [8192, 8192, 1, 2048, 8192, 8192, 8192, 8192]
    - [23, 32.324]
  - - [8192, 8192, 1, 4096, 8192, 8192, 8192, 8192]
    - [23, 34.133]
  - - [8192, 8192, 1, 8192, 8192, 8192, 8192, 8192]
    - [12, 35.191]
- null
- null
- DeviceEfficiency
- GridBased
