library/src/amd_detail/rocblaslt/src/Tensile/Logic/streamk/aquavanjaram/aquavanjaram942_Cijk_Ailk_Bjlk_BBS_BH_UserArgs.yaml
- {MinimumRequiredVersion: 4.33.0}
- aquavanjaram942
- gfx942
- [Device 0049, Device 0050]
    SolutionIndex: 0
    SolutionNameMin: Cijk_Ailk_Bjlk_BBS_BH_UserArgs_MT256x256x16_MI16x16x1_SN_LDSB1_GSU0_GSUC0_GSUWGMRR0_K1_LBSPPA2048_LBSPPB2048_MIWT8_8_NLCB2_PLR1_SU0_SUM0_SUS0_SVW4_SKXCCM0_VWA4_VWB4_WGM8
    SolutionIndex: 1
    SolutionNameMin: Cijk_Ailk_Bjlk_BBS_BH_UserArgs_MT256x256x16_MI16x16x1_SN_LDSB0_GSU0_GSUC0_GSUWGMRR0_K1_LBSPPA2048_LBSPPB2048_MIWT8_8_NLCB1_PLR0_SU0_SUM0_SUS0_SVW4_SKXCCM8_VWA4_VWB4_WGM1
    SolutionIndex: 2
    SolutionNameMin: Cijk_Ailk_Bjlk_BBS_BH_UserArgs_MT256x256x16_MI16x16x1_SN_LDSB0_GSU0_GSUC0_GSUWGMRR0_K1_LBSPPA2048_LBSPPB2048_MIWT8_8_NLCB2_PLR1_SU0_SUM0_SUS0_SVW4_SKXCCM8_VWA4_VWB4_WGM1
    SolutionIndex: 3
    SolutionNameMin: Cijk_Ailk_Bjlk_BBS_BH_UserArgs_MT256x256x16_MI16x16x1_SN_LDSB0_GSU0_GSUC0_GSUWGMRR0_K1_LBSPPA2048_LBSPPB2048_MIWT8_8_NLCB2_PLR0_SU0_SUM0_SUS0_SVW4_SKXCCM8_VWA4_VWB4_WGM1
    SolutionIndex: 4
    SolutionNameMin: Cijk_Ailk_Bjlk_BBS_BH_UserArgs_MT128x256x16_MI16x16x1_SN_LDSB0_GSU0_GSUC0_GSUWGMRR0_K1_LBSPPA1024_LBSPPB2048_MIWT4_8_NLCB1_PLR1_SU0_SUM0_SUS0_SVW4_SKXCCM8_VWA4_VWB4_WGM1
    SolutionIndex: 5
    SolutionNameMin: Cijk_Ailk_Bjlk_BBS_BH_UserArgs_MT128x256x16_MI16x16x1_SN_LDSB0_GSU0_GSUC0_GSUWGMRR0_K1_LBSPPA1024_LBSPPB2048_MIWT4_8_NLCB1_PLR0_SU0_SUM0_SUS0_SVW4_SKXCCM8_VWA4_VWB4_WGM1
    SolutionIndex: 6
    SolutionNameMin: Cijk_Ailk_Bjlk_BBS_BH_UserArgs_MT128x256x16_MI16x16x1_SN_LDSB0_GSU0_GSUC0_GSUWGMRR0_K1_LBSPPA1024_LBSPPB2048_MIWT4_8_NLCB1_PLR1_SU0_SUM0_SUS0_SVW4_SKXCCM8_VWA4_VWB4_WGM8
    SolutionIndex: 7
    SolutionNameMin: Cijk_Ailk_Bjlk_BBS_BH_UserArgs_MT256x128x16_MI16x16x1_SN_LDSB0_GSU0_GSUC0_GSUWGMRR0_K1_LBSPPA2048_LBSPPB1024_MIWT8_4_NLCB1_PLR0_SU0_SUM0_SUS0_SVW4_SKXCCM8_VWA4_VWB4_WGM1
    SolutionIndex: 8
    SolutionNameMin: Cijk_Ailk_Bjlk_BBS_BH_UserArgs_MT256x256x16_MI16x16x1_SN_LDSB1_GSU0_GSUC0_GSUWGMRR0_K1_LBSPPA2048_LBSPPB2048_MIWT8_8_NLCB1_PLR0_SU0_SUM0_SUS0_SVW4_SKXCCM8_VWA4_VWB4_WGM1
    SolutionIndex: 9
    SolutionNameMin: Cijk_Ailk_Bjlk_BBS_BH_UserArgs_MT256x256x16_MI16x16x1_SN_LDSB1_GSU0_GSUC0_GSUWGMRR0_K1_LBSPPA2048_LBSPPB2048_MIWT8_8_NLCB2_PLR0_SU0_SUM0_SUS0_SVW4_SKXCCM8_VWA4_VWB4_WGM1
    SolutionIndex: 10
    SolutionNameMin: Cijk_Ailk_Bjlk_BBS_BH_UserArgs_MT256x256x16_MI16x16x1_SN_LDSB1_GSU0_GSUC0_GSUWGMRR0_K1_LBSPPA2048_LBSPPB2048_MIWT8_8_NLCB2_PLR1_SU0_SUM0_SUS0_SVW4_SKXCCM8_VWA4_VWB4_WGM8
    SolutionIndex: 11
    SolutionNameMin: Cijk_Ailk_Bjlk_BBS_BH_UserArgs_MT256x256x16_MI16x16x1_SN_LDSB1_GSU0_GSUC0_GSUWGMRR0_K1_LBSPPA2048_LBSPPB2048_MIWT8_8_NLCB2_PLR0_SU0_SUM0_SUS0_SVW4_SKXCCM8_VWA4_VWB4_WGM8
    SolutionIndex: 12
    SolutionNameMin: Cijk_Ailk_Bjlk_BBS_BH_UserArgs_MT128x256x16_MI16x16x1_SN_LDSB1_GSU0_GSUC0_GSUWGMRR0_K1_LBSPPA1024_LBSPPB2048_MIWT4_8_NLCB1_PLR1_SU0_SUM0_SUS0_SVW4_SKXCCM8_VWA4_VWB4_WGM1
    SolutionIndex: 13
    SolutionNameMin: Cijk_Ailk_Bjlk_BBS_BH_UserArgs_MT128x256x16_MI16x16x1_SN_LDSB1_GSU0_GSUC0_GSUWGMRR0_K1_LBSPPA1024_LBSPPB2048_MIWT4_8_NLCB2_PLR1_SU0_SUM0_SUS0_SVW4_SKXCCM8_VWA4_VWB4_WGM1
    SolutionIndex: 14
    SolutionNameMin: Cijk_Ailk_Bjlk_BBS_BH_UserArgs_MT128x256x16_MI16x16x1_SN_LDSB1_GSU0_GSUC0_GSUWGMRR0_K1_LBSPPA1024_LBSPPB2048_MIWT4_8_NLCB1_PLR1_SU0_SUM0_SUS0_SVW4_SKXCCM8_VWA4_VWB4_WGM8
    SolutionIndex: 15
    SolutionNameMin: Cijk_Ailk_Bjlk_BBS_BH_UserArgs_MT128x256x16_MI16x16x1_SN_LDSB1_GSU0_GSUC0_GSUWGMRR0_K1_LBSPPA1024_LBSPPB2048_MIWT4_8_NLCB2_PLR0_SU0_SUM0_SUS0_SVW4_SKXCCM8_VWA4_VWB4_WGM8
    SolutionIndex: 16
    SolutionNameMin: Cijk_Ailk_Bjlk_BBS_BH_UserArgs_MT64x128x32_MI16x16x1_SN_LDSB0_GSU0_GSUC0_GSUWGMRR0_K1_LBSPPA512_LBSPPB1024_MIWT2_4_NLCB2_PLR0_SU0_SUM0_SUS0_SVW2_SKXCCM0_VWA2_VWB2_WGM1
    SolutionIndex: 17
    SolutionNameMin: Cijk_Ailk_Bjlk_BBS_BH_UserArgs_MT64x64x32_MI16x16x1_SN_LDSB0_GSU0_GSUC0_GSUWGMRR0_K1_LBSPPA512_LBSPPB512_MIWT2_2_NLCB1_PLR0_SU0_SUM0_SUS0_SVW2_SKXCCM0_VWA2_VWB2_WGM1
    SolutionIndex: 18
    SolutionNameMin: Cijk_Ailk_Bjlk_BBS_BH_UserArgs_MT64x64x32_MI16x16x1_SN_LDSB0_GSU0_GSUC0_GSUWGMRR0_K1_LBSPPA512_LBSPPB512_MIWT2_2_NLCB1_PLR0_SU0_SUM0_SUS0_SVW2_SKXCCM0_VWA2_VWB2_WGM8
    SolutionIndex: 19
    SolutionNameMin: Cijk_Ailk_Bjlk_BBS_BH_UserArgs_MT64x128x32_MI16x16x1_SN_LDSB0_GSU0_GSUC0_GSUWGMRR0_K1_LBSPPA512_LBSPPB1024_MIWT2_4_NLCB1_PLR0_SU0_SUM0_SUS0_SVW2_SKXCCM8_VWA2_VWB2_WGM1
    SolutionIndex: 20
    SolutionNameMin: Cijk_Ailk_Bjlk_BBS_BH_UserArgs_MT64x128x32_MI16x16x1_SN_LDSB0_GSU0_GSUC0_GSUWGMRR0_K1_LBSPPA512_LBSPPB1024_MIWT2_4_NLCB2_PLR0_SU0_SUM0_SUS0_SVW2_SKXCCM8_VWA2_VWB2_WGM1
    SolutionIndex: 21
    SolutionNameMin: Cijk_Ailk_Bjlk_BBS_BH_UserArgs_MT64x128x32_MI16x16x1_SN_LDSB0_GSU0_GSUC0_GSUWGMRR0_K1_LBSPPA512_LBSPPB1024_MIWT2_4_NLCB2_PLR0_SU0_SUM0_SUS0_SVW2_SKXCCM8_VWA2_VWB2_WGM8
    SolutionIndex: 22
    SolutionNameMin: Cijk_Ailk_Bjlk_BBS_BH_UserArgs_MT128x64x32_MI16x16x1_SN_LDSB0_GSU0_GSUC0_GSUWGMRR0_K1_LBSPPA1024_LBSPPB512_MIWT4_2_NLCB1_PLR0_SU0_SUM0_SUS0_SVW2_SKXCCM8_VWA2_VWB2_WGM1
    SolutionIndex: 23
    SolutionNameMin: Cijk_Ailk_Bjlk_BBS_BH_UserArgs_MT64x64x32_MI16x16x1_SN_LDSB0_GSU0_GSUC0_GSUWGMRR0_K1_LBSPPA512_LBSPPB512_MIWT2_2_NLCB1_PLR0_SU0_SUM0_SUS0_SVW2_SKXCCM8_VWA2_VWB2_WGM1
    SolutionIndex: 24
    SolutionNameMin: Cijk_Ailk_Bjlk_BBS_BH_UserArgs_MT256x256x32_MI16x16x1_SN_LDSB0_GSU0_GSUC0_GSUWGMRR0_K1_LBSPPA2048_LBSPPB2048_MIWT8_8_NLCB1_PLR0_SU0_SUM0_SUS0_SVW4_SKXCCM0_VWA4_VWB4_WGM1
    SolutionIndex: 25
    SolutionNameMin: Cijk_Ailk_Bjlk_BBS_BH_UserArgs_MT256x256x32_MI16x16x1_SN_LDSB0_GSU0_GSUC0_GSUWGMRR0_K1_LBSPPA2048_LBSPPB2048_MIWT8_8_NLCB2_PLR0_SU0_SUM0_SUS0_SVW4_SKXCCM0_VWA4_VWB4_WGM1
    SolutionIndex: 26
    SolutionNameMin: Cijk_Ailk_Bjlk_BBS_BH_UserArgs_MT128x256x32_MI16x16x1_SN_LDSB0_GSU0_GSUC0_GSUWGMRR0_K1_LBSPPA1024_LBSPPB2048_MIWT4_8_NLCB1_PLR0_SU0_SUM0_SUS0_SVW4_SKXCCM0_VWA4_VWB4_WGM1
    SolutionIndex: 27
    SolutionNameMin: Cijk_Ailk_Bjlk_BBS_BH_UserArgs_MT128x256x32_MI16x16x1_SN_LDSB0_GSU0_GSUC0_GSUWGMRR0_K1_LBSPPA1024_LBSPPB2048_MIWT4_8_NLCB2_PLR0_SU0_SUM0_SUS0_SVW4_SKXCCM0_VWA4_VWB4_WGM1
    SolutionIndex: 28
    SolutionNameMin: Cijk_Ailk_Bjlk_BBS_BH_UserArgs_MT256x128x32_MI16x16x1_SN_LDSB0_GSU0_GSUC0_GSUWGMRR0_K1_LBSPPA2048_LBSPPB1024_MIWT8_4_NLCB2_PLR0_SU0_SUM0_SUS0_SVW4_SKXCCM0_VWA4_VWB4_WGM1
    SolutionIndex: 29
    SolutionNameMin: Cijk_Ailk_Bjlk_BBS_BH_UserArgs_MT256x128x32_MI16x16x1_SN_LDSB0_GSU0_GSUC0_GSUWGMRR0_K1_LBSPPA2048_LBSPPB1024_MIWT8_4_NLCB1_PLR0_SU0_SUM0_SUS0_SVW4_SKXCCM0_VWA4_VWB4_WGM8
    SolutionIndex: 30
    SolutionNameMin: Cijk_Ailk_Bjlk_BBS_BH_UserArgs_MT128x128x32_MI16x16x1_SN_LDSB0_GSU0_GSUC0_GSUWGMRR0_K1_LBSPPA1024_LBSPPB1024_MIWT4_4_NLCB1_PLR0_SU0_SUM0_SUS0_SVW4_SKXCCM0_VWA4_VWB4_WGM1
    SolutionIndex: 31
    SolutionNameMin: Cijk_Ailk_Bjlk_BBS_BH_UserArgs_MT128x128x32_MI16x16x1_SN_LDSB0_GSU0_GSUC0_GSUWGMRR0_K1_LBSPPA1024_LBSPPB1024_MIWT4_4_NLCB2_PLR0_SU0_SUM0_SUS0_SVW4_SKXCCM0_VWA4_VWB4_WGM1
    SolutionIndex: 32
    SolutionNameMin: Cijk_Ailk_Bjlk_BBS_BH_UserArgs_MT128x128x32_MI16x16x1_SN_LDSB0_GSU0_GSUC0_GSUWGMRR0_K1_LBSPPA1024_LBSPPB1024_MIWT4_4_NLCB1_PLR0_SU0_SUM0_SUS0_SVW4_SKXCCM0_VWA4_VWB4_WGM8
    SolutionIndex: 33
    SolutionNameMin: Cijk_Ailk_Bjlk_BBS_BH_UserArgs_MT256x256x32_MI16x16x1_SN_LDSB0_GSU0_GSUC0_GSUWGMRR0_K1_LBSPPA2048_LBSPPB2048_MIWT8_8_NLCB1_PLR0_SU0_SUM0_SUS0_SVW4_SKXCCM8_VWA4_VWB4_WGM1
    SolutionIndex: 34
    SolutionNameMin: Cijk_Ailk_Bjlk_BBS_BH_UserArgs_MT256x256x32_MI16x16x1_SN_LDSB0_GSU0_GSUC0_GSUWGMRR0_K1_LBSPPA2048_LBSPPB2048_MIWT8_8_NLCB2_PLR0_SU0_SUM0_SUS0_SVW4_SKXCCM8_VWA4_VWB4_WGM1
    SolutionIndex: 35
    SolutionNameMin: Cijk_Ailk_Bjlk_BBS_BH_UserArgs_MT256x256x32_MI16x16x1_SN_LDSB0_GSU0_GSUC0_GSUWGMRR0_K1_LBSPPA2048_LBSPPB2048_MIWT8_8_NLCB1_PLR0_SU0_SUM0_SUS0_SVW4_SKXCCM8_VWA4_VWB4_WGM8
    SolutionIndex: 36
    SolutionNameMin: Cijk_Ailk_Bjlk_BBS_BH_UserArgs_MT256x256x32_MI16x16x1_SN_LDSB0_GSU0_GSUC0_GSUWGMRR0_K1_LBSPPA2048_LBSPPB2048_MIWT8_8_NLCB2_PLR0_SU0_SUM0_SUS0_SVW4_SKXCCM8_VWA4_VWB4_WGM8
    SolutionIndex: 37
    SolutionNameMin: Cijk_Ailk_Bjlk_BBS_BH_UserArgs_MT128x256x32_MI16x16x1_SN_LDSB0_GSU0_GSUC0_GSUWGMRR0_K1_LBSPPA1024_LBSPPB2048_MIWT4_8_NLCB1_PLR0_SU0_SUM0_SUS0_SVW4_SKXCCM8_VWA4_VWB4_WGM1
    SolutionIndex: 38
    SolutionNameMin: Cijk_Ailk_Bjlk_BBS_BH_UserArgs_MT128x256x32_MI16x16x1_SN_LDSB0_GSU0_GSUC0_GSUWGMRR0_K1_LBSPPA1024_LBSPPB2048_MIWT4_8_NLCB2_PLR0_SU0_SUM0_SUS0_SVW4_SKXCCM8_VWA4_VWB4_WGM1
    SolutionIndex: 39
    SolutionNameMin: Cijk_Ailk_Bjlk_BBS_BH_UserArgs_MT128x256x32_MI16x16x1_SN_LDSB0_GSU0_GSUC0_GSUWGMRR0_K1_LBSPPA1024_LBSPPB2048_MIWT4_8_NLCB1_PLR0_SU0_SUM0_SUS0_SVW4_SKXCCM8_VWA4_VWB4_WGM8
    SolutionIndex: 40
    SolutionNameMin: Cijk_Ailk_Bjlk_BBS_BH_UserArgs_MT128x256x32_MI16x16x1_SN_LDSB0_GSU0_GSUC0_GSUWGMRR0_K1_LBSPPA1024_LBSPPB2048_MIWT4_8_NLCB2_PLR0_SU0_SUM0_SUS0_SVW4_SKXCCM8_VWA4_VWB4_WGM8
    SolutionIndex: 41
    SolutionNameMin: Cijk_Ailk_Bjlk_BBS_BH_UserArgs_MT256x128x32_MI16x16x1_SN_LDSB0_GSU0_GSUC0_GSUWGMRR0_K1_LBSPPA2048_LBSPPB1024_MIWT8_4_NLCB1_PLR0_SU0_SUM0_SUS0_SVW4_SKXCCM8_VWA4_VWB4_WGM1
    SolutionIndex: 42
    SolutionNameMin: Cijk_Ailk_Bjlk_BBS_BH_UserArgs_MT256x128x32_MI16x16x1_SN_LDSB0_GSU0_GSUC0_GSUWGMRR0_K1_LBSPPA2048_LBSPPB1024_MIWT8_4_NLCB1_PLR0_SU0_SUM0_SUS0_SVW4_SKXCCM8_VWA4_VWB4_WGM8
    SolutionIndex: 43
    SolutionNameMin: Cijk_Ailk_Bjlk_BBS_BH_UserArgs_MT256x128x32_MI16x16x1_SN_LDSB0_GSU0_GSUC0_GSUWGMRR0_K1_LBSPPA2048_LBSPPB1024_MIWT8_4_NLCB2_PLR0_SU0_SUM0_SUS0_SVW4_SKXCCM8_VWA4_VWB4_WGM8
    SolutionIndex: 44
    SolutionNameMin: Cijk_Ailk_Bjlk_BBS_BH_UserArgs_MT128x128x32_MI16x16x1_SN_LDSB0_GSU0_GSUC0_GSUWGMRR0_K1_LBSPPA1024_LBSPPB1024_MIWT4_4_NLCB1_PLR0_SU0_SUM0_SUS0_SVW4_SKXCCM8_VWA4_VWB4_WGM1
    SolutionIndex: 45
    SolutionNameMin: Cijk_Ailk_Bjlk_BBS_BH_UserArgs_MT128x128x32_MI16x16x1_SN_LDSB0_GSU0_GSUC0_GSUWGMRR0_K1_LBSPPA1024_LBSPPB1024_MIWT4_4_NLCB2_PLR0_SU0_SUM0_SUS0_SVW4_SKXCCM8_VWA4_VWB4_WGM1
    SolutionIndex: 46
    SolutionNameMin: Cijk_Ailk_Bjlk_BBS_BH_UserArgs_MT128x128x32_MI16x16x1_SN_LDSB0_GSU0_GSUC0_GSUWGMRR0_K1_LBSPPA1024_LBSPPB1024_MIWT4_4_NLCB1_PLR0_SU0_SUM0_SUS0_SVW4_SKXCCM8_VWA4_VWB4_WGM8
    SolutionIndex: 47
    SolutionNameMin: Cijk_Ailk_Bjlk_BBS_BH_UserArgs_MT128x128x32_MI16x16x1_SN_LDSB0_GSU0_GSUC0_GSUWGMRR0_K1_LBSPPA1024_LBSPPB1024_MIWT4_4_NLCB2_PLR0_SU0_SUM0_SUS0_SVW4_SKXCCM8_VWA4_VWB4_WGM8
    SolutionIndex: 48
    SolutionNameMin: Cijk_Ailk_Bjlk_BBS_BH_UserArgs_MT32x64x64_MI16x16x1_SN_LDSB0_GSU0_GSUC0_GSUWGMRR0_K1_LBSPPA256_LBSPPB512_MIWT1_2_NLCB1_PLR0_SU0_SUM0_SUS0_SVW1_SKXCCM0_VWA1_VWB1_WGM1
    SolutionIndex: 49
    SolutionNameMin: Cijk_Ailk_Bjlk_BBS_BH_UserArgs_MT32x64x64_MI16x16x1_SN_LDSB0_GSU0_GSUC0_GSUWGMRR0_K1_LBSPPA256_LBSPPB512_MIWT1_2_NLCB2_PLR0_SU0_SUM0_SUS0_SVW1_SKXCCM0_VWA1_VWB1_WGM1
    SolutionIndex: 50
    SolutionNameMin: Cijk_Ailk_Bjlk_BBS_BH_UserArgs_MT64x32x64_MI16x16x1_SN_LDSB0_GSU0_GSUC0_GSUWGMRR0_K1_LBSPPA512_LBSPPB256_MIWT2_1_NLCB1_PLR0_SU0_SUM0_SUS0_SVW1_SKXCCM0_VWA1_VWB1_WGM1
    SolutionIndex: 51
    SolutionNameMin: Cijk_Ailk_Bjlk_BBS_BH_UserArgs_MT32x32x64_MI16x16x1_SN_LDSB0_GSU0_GSUC0_GSUWGMRR0_K1_LBSPPA256_LBSPPB256_MIWT1_1_NLCB1_PLR0_SU0_SUM0_SUS0_SVW1_SKXCCM0_VWA1_VWB1_WGM1
    SolutionIndex: 52
    SolutionNameMin: Cijk_Ailk_Bjlk_BBS_BH_UserArgs_MT32x64x64_MI16x16x1_SN_LDSB0_GSU0_GSUC0_GSUWGMRR0_K1_LBSPPA256_LBSPPB512_MIWT1_2_NLCB1_PLR0_SU0_SUM0_SUS0_SVW1_SKXCCM8_VWA1_VWB1_WGM1
    SolutionIndex: 53
    SolutionNameMin: Cijk_Ailk_Bjlk_BBS_BH_UserArgs_MT32x64x64_MI16x16x1_SN_LDSB0_GSU0_GSUC0_GSUWGMRR0_K1_LBSPPA256_LBSPPB512_MIWT1_2_NLCB2_PLR0_SU0_SUM0_SUS0_SVW1_SKXCCM8_VWA1_VWB1_WGM1
    SolutionIndex: 54
    SolutionNameMin: Cijk_Ailk_Bjlk_BBS_BH_UserArgs_MT64x32x64_MI16x16x1_SN_LDSB0_GSU0_GSUC0_GSUWGMRR0_K1_LBSPPA512_LBSPPB256_MIWT2_1_NLCB1_PLR0_SU0_SUM0_SUS0_SVW1_SKXCCM8_VWA1_VWB1_WGM1
    SolutionIndex: 55
    SolutionNameMin: Cijk_Ailk_Bjlk_BBS_BH_UserArgs_MT32x32x64_MI16x16x1_SN_LDSB0_GSU0_GSUC0_GSUWGMRR0_K1_LBSPPA256_LBSPPB256_MIWT1_1_NLCB1_PLR0_SU0_SUM0_SUS0_SVW1_SKXCCM8_VWA1_VWB1_WGM1
    SolutionIndex: 56
    SolutionNameMin: Cijk_Ailk_Bjlk_BBS_BH_UserArgs_MT32x32x64_MI16x16x1_SN_LDSB0_GSU0_GSUC0_GSUWGMRR0_K1_LBSPPA256_LBSPPB256_MIWT1_1_NLCB1_PLR0_SU0_SUM0_SUS0_SVW1_SKXCCM8_VWA1_VWB1_WGM8
    SolutionIndex: 57
    SolutionNameMin: Cijk_Ailk_Bjlk_BBS_BH_UserArgs_MT64x128x64_MI16x16x1_SN_LDSB0_GSU0_GSUC0_GSUWGMRR0_K1_LBSPPA512_LBSPPB1024_MIWT2_4_NLCB1_PLR0_SU0_SUM0_SUS0_SVW2_SKXCCM0_VWA2_VWB2_WGM1
    SolutionIndex: 58
    SolutionNameMin: Cijk_Ailk_Bjlk_BBS_BH_UserArgs_MT64x128x64_MI16x16x1_SN_LDSB0_GSU0_GSUC0_GSUWGMRR0_K1_LBSPPA512_LBSPPB1024_MIWT2_4_NLCB2_PLR0_SU0_SUM0_SUS0_SVW2_SKXCCM0_VWA2_VWB2_WGM1
    SolutionIndex: 59
    SolutionNameMin: Cijk_Ailk_Bjlk_BBS_BH_UserArgs_MT64x128x64_MI16x16x1_SN_LDSB0_GSU0_GSUC0_GSUWGMRR0_K1_LBSPPA512_LBSPPB1024_MIWT2_4_NLCB2_PLR0_SU0_SUM0_SUS0_SVW2_SKXCCM0_VWA2_VWB2_WGM8
    SolutionIndex: 60
    SolutionNameMin: Cijk_Ailk_Bjlk_BBS_BH_UserArgs_MT128x64x64_MI16x16x1_SN_LDSB0_GSU0_GSUC0_GSUWGMRR0_K1_LBSPPA1024_LBSPPB512_MIWT4_2_NLCB2_PLR0_SU0_SUM0_SUS0_SVW2_SKXCCM0_VWA2_VWB2_WGM8
    SolutionIndex: 61
    SolutionNameMin: Cijk_Ailk_Bjlk_BBS_BH_UserArgs_MT64x64x64_MI16x16x1_SN_LDSB0_GSU0_GSUC0_GSUWGMRR0_K1_LBSPPA512_LBSPPB512_MIWT2_2_NLCB1_PLR0_SU0_SUM0_SUS0_SVW2_SKXCCM0_VWA2_VWB2_WGM1
    SolutionIndex: 62
    SolutionNameMin: Cijk_Ailk_Bjlk_BBS_BH_UserArgs_MT64x64x64_MI16x16x1_SN_LDSB0_GSU0_GSUC0_GSUWGMRR0_K1_LBSPPA512_LBSPPB512_MIWT2_2_NLCB2_PLR0_SU0_SUM0_SUS0_SVW2_SKXCCM0_VWA2_VWB2_WGM1
    SolutionIndex: 63
    SolutionNameMin: Cijk_Ailk_Bjlk_BBS_BH_UserArgs_MT64x128x64_MI16x16x1_SN_LDSB0_GSU0_GSUC0_GSUWGMRR0_K1_LBSPPA512_LBSPPB1024_MIWT2_4_NLCB1_PLR0_SU0_SUM0_SUS0_SVW2_SKXCCM8_VWA2_VWB2_WGM1
    SolutionIndex: 64
    SolutionNameMin: Cijk_Ailk_Bjlk_BBS_BH_UserArgs_MT64x128x64_MI16x16x1_SN_LDSB0_GSU0_GSUC0_GSUWGMRR0_K1_LBSPPA512_LBSPPB1024_MIWT2_4_NLCB2_PLR0_SU0_SUM0_SUS0_SVW2_SKXCCM8_VWA2_VWB2_WGM1
    SolutionIndex: 65
    SolutionNameMin: Cijk_Ailk_Bjlk_BBS_BH_UserArgs_MT64x128x64_MI16x16x1_SN_LDSB0_GSU0_GSUC0_GSUWGMRR0_K1_LBSPPA512_LBSPPB1024_MIWT2_4_NLCB1_PLR0_SU0_SUM0_SUS0_SVW2_SKXCCM8_VWA2_VWB2_WGM8
    SolutionIndex: 66
    SolutionNameMin: Cijk_Ailk_Bjlk_BBS_BH_UserArgs_MT64x128x64_MI16x16x1_SN_LDSB0_GSU0_GSUC0_GSUWGMRR0_K1_LBSPPA512_LBSPPB1024_MIWT2_4_NLCB2_PLR0_SU0_SUM0_SUS0_SVW2_SKXCCM8_VWA2_VWB2_WGM8
    SolutionIndex: 67
    SolutionNameMin: Cijk_Ailk_Bjlk_BBS_BH_UserArgs_MT128x64x64_MI16x16x1_SN_LDSB0_GSU0_GSUC0_GSUWGMRR0_K1_LBSPPA1024_LBSPPB512_MIWT4_2_NLCB1_PLR0_SU0_SUM0_SUS0_SVW2_SKXCCM8_VWA2_VWB2_WGM1
    SolutionIndex: 68
    SolutionNameMin: Cijk_Ailk_Bjlk_BBS_BH_UserArgs_MT128x64x64_MI16x16x1_SN_LDSB0_GSU0_GSUC0_GSUWGMRR0_K1_LBSPPA1024_LBSPPB512_MIWT4_2_NLCB2_PLR0_SU0_SUM0_SUS0_SVW2_SKXCCM8_VWA2_VWB2_WGM1
    SolutionIndex: 69
    SolutionNameMin: Cijk_Ailk_Bjlk_BBS_BH_UserArgs_MT128x64x64_MI16x16x1_SN_LDSB0_GSU0_GSUC0_GSUWGMRR0_K1_LBSPPA1024_LBSPPB512_MIWT4_2_NLCB1_PLR0_SU0_SUM0_SUS0_SVW2_SKXCCM8_VWA2_VWB2_WGM8
    SolutionIndex: 70
    SolutionNameMin: Cijk_Ailk_Bjlk_BBS_BH_UserArgs_MT128x64x64_MI16x16x1_SN_LDSB0_GSU0_GSUC0_GSUWGMRR0_K1_LBSPPA1024_LBSPPB512_MIWT4_2_NLCB2_PLR0_SU0_SUM0_SUS0_SVW2_SKXCCM8_VWA2_VWB2_WGM8
    SolutionIndex: 71
    SolutionNameMin: Cijk_Ailk_Bjlk_BBS_BH_UserArgs_MT64x64x64_MI16x16x1_SN_LDSB0_GSU0_GSUC0_GSUWGMRR0_K1_LBSPPA512_LBSPPB512_MIWT2_2_NLCB1_PLR0_SU0_SUM0_SUS0_SVW2_SKXCCM8_VWA2_VWB2_WGM1
    SolutionIndex: 72
    SolutionNameMin: Cijk_Ailk_Bjlk_BBS_BH_UserArgs_MT64x64x64_MI16x16x1_SN_LDSB0_GSU0_GSUC0_GSUWGMRR0_K1_LBSPPA512_LBSPPB512_MIWT2_2_NLCB2_PLR0_SU0_SUM0_SUS0_SVW2_SKXCCM8_VWA2_VWB2_WGM1
    SolutionIndex: 73
    SolutionNameMin: Cijk_Ailk_Bjlk_BBS_BH_UserArgs_MT64x64x64_MI16x16x1_SN_LDSB0_GSU0_GSUC0_GSUWGMRR0_K1_LBSPPA512_LBSPPB512_MIWT2_2_NLCB1_PLR0_SU0_SUM0_SUS0_SVW2_SKXCCM8_VWA2_VWB2_WGM8
    SolutionIndex: 74
    SolutionNameMin: Cijk_Ailk_Bjlk_BBS_BH_UserArgs_MT64x64x64_MI16x16x1_SN_LDSB0_GSU0_GSUC0_GSUWGMRR0_K1_LBSPPA512_LBSPPB512_MIWT2_2_NLCB2_PLR0_SU0_SUM0_SUS0_SVW2_SKXCCM8_VWA2_VWB2_WGM8
    SolutionIndex: 75
    SolutionNameMin: Cijk_Ailk_Bjlk_BBS_BH_UserArgs_MT128x128x64_MI16x16x1_SN_LDSB0_GSU0_GSUC0_GSUWGMRR0_K1_LBSPPA1024_LBSPPB1024_MIWT4_4_NLCB1_PLR0_SU0_SUM0_SUS0_SVW4_SKXCCM0_VWA4_VWB4_WGM1
    SolutionIndex: 76
    SolutionNameMin: Cijk_Ailk_Bjlk_BBS_BH_UserArgs_MT128x128x64_MI16x16x1_SN_LDSB0_GSU0_GSUC0_GSUWGMRR0_K1_LBSPPA1024_LBSPPB1024_MIWT4_4_NLCB2_PLR0_SU0_SUM0_SUS0_SVW4_SKXCCM0_VWA4_VWB4_WGM1
    SolutionIndex: 77
    SolutionNameMin: Cijk_Ailk_Bjlk_BBS_BH_UserArgs_MT128x128x64_MI16x16x1_SN_LDSB0_GSU0_GSUC0_GSUWGMRR0_K1_LBSPPA1024_LBSPPB1024_MIWT4_4_NLCB1_PLR0_SU0_SUM0_SUS0_SVW4_SKXCCM0_VWA4_VWB4_WGM8
    SolutionIndex: 78
    SolutionNameMin: Cijk_Ailk_Bjlk_BBS_BH_UserArgs_MT128x128x64_MI16x16x1_SN_LDSB0_GSU0_GSUC0_GSUWGMRR0_K1_LBSPPA1024_LBSPPB1024_MIWT4_4_NLCB2_PLR0_SU0_SUM0_SUS0_SVW4_SKXCCM0_VWA4_VWB4_WGM8
    SolutionIndex: 79
    SolutionNameMin: Cijk_Ailk_Bjlk_BBS_BH_UserArgs_MT128x128x64_MI16x16x1_SN_LDSB0_GSU0_GSUC0_GSUWGMRR0_K1_LBSPPA1024_LBSPPB1024_MIWT4_4_NLCB1_PLR0_SU0_SUM0_SUS0_SVW4_SKXCCM8_VWA4_VWB4_WGM1
    SolutionIndex: 80
    SolutionNameMin: Cijk_Ailk_Bjlk_BBS_BH_UserArgs_MT128x128x64_MI16x16x1_SN_LDSB0_GSU0_GSUC0_GSUWGMRR0_K1_LBSPPA1024_LBSPPB1024_MIWT4_4_NLCB2_PLR0_SU0_SUM0_SUS0_SVW4_SKXCCM8_VWA4_VWB4_WGM1
    SolutionIndex: 81
    SolutionNameMin: Cijk_Ailk_Bjlk_BBS_BH_UserArgs_MT128x128x64_MI16x16x1_SN_LDSB0_GSU0_GSUC0_GSUWGMRR0_K1_LBSPPA1024_LBSPPB1024_MIWT4_4_NLCB1_PLR0_SU0_SUM0_SUS0_SVW4_SKXCCM8_VWA4_VWB4_WGM8
    SolutionIndex: 82
    SolutionNameMin: Cijk_Ailk_Bjlk_BBS_BH_UserArgs_MT128x128x64_MI16x16x1_SN_LDSB0_GSU0_GSUC0_GSUWGMRR0_K1_LBSPPA1024_LBSPPB1024_MIWT4_4_NLCB2_PLR0_SU0_SUM0_SUS0_SVW4_SKXCCM8_VWA4_VWB4_WGM8
- - - [128, 128, 1, 128, 128, 128, 128, 128]
    - [51, 0.051]
  - - [128, 128, 1, 256, 128, 128, 128, 128]
    - [51, 0.081]
  - - [128, 128, 1, 512, 128, 128, 128, 128]
    - [55, 0.117]
  - - [128, 128, 1, 1024, 128, 128, 128, 128]
    - [55, 0.137]
  - - [128, 128, 1, 2048, 128, 128, 128, 128]
    - [55, 0.17]
  - - [128, 128, 1, 4096, 128, 128, 128, 128]
    - [55, 0.416]
  - - [128, 128, 1, 8192, 128, 128, 128, 128]
    - [55, 0.809]
  - - [128, 256, 1, 128, 128, 128, 128, 256]
    - [51, 0.102]
  - - [128, 256, 1, 256, 128, 128, 128, 256]
    - [55, 0.157]
  - - [128, 256, 1, 512, 128, 128, 128, 256]
    - [55, 0.228]
  - - [128, 256, 1, 1024, 128, 128, 128, 256]
    - [55, 0.296]
  - - [128, 256, 1, 2048, 128, 128, 128, 256]
    - [55, 0.631]
  - - [128, 256, 1, 4096, 128, 128, 128, 256]
    - [51, 1.186]
  - - [128, 256, 1, 8192, 128, 128, 128, 256]
    - [55, 2.013]
  - - [128, 512, 1, 128, 128, 128, 128, 512]
    - [51, 0.195]
  - - [128, 512, 1, 256, 128, 128, 128, 512]
    - [55, 0.31]
  - - [128, 512, 1, 512, 128, 128, 128, 512]
    - [55, 0.473]
  - - [128, 512, 1, 1024, 128, 128, 128, 512]
    - [51, 0.897]
  - - [128, 512, 1, 2048, 128, 128, 128, 512]
    - [51, 1.552]
  - - [128, 512, 1, 4096, 128, 128, 128, 512]
    - [55, 2.441]
  - - [128, 512, 1, 8192, 128, 128, 128, 512]
    - [55, 3.58]
  - - [128, 1024, 1, 128, 128, 128, 128, 1024]
    - [55, 0.378]
  - - [128, 1024, 1, 256, 128, 128, 128, 1024]
    - [51, 0.636]
  - - [128, 1024, 1, 512, 128, 128, 128, 1024]
    - [55, 1.085]
  - - [128, 1024, 1, 1024, 128, 128, 128, 1024]
    - [51, 1.837]
  - - [128, 1024, 1, 2048, 128, 128, 128, 1024]
    - [55, 2.803]
  - - [128, 1024, 1, 4096, 128, 128, 128, 1024]
    - [50, 3.988]
  - - [128, 1024, 1, 8192, 128, 128, 128, 1024]
    - [52, 5.59]
  - - [128, 2048, 1, 128, 128, 128, 128, 2048]
    - [55, 0.774]
  - - [128, 2048, 1, 256, 128, 128, 128, 2048]
    - [51, 1.267]
  - - [128, 2048, 1, 512, 128, 128, 128, 2048]
    - [51, 2.032]
  - - [128, 2048, 1, 1024, 128, 128, 128, 2048]
    - [55, 2.998]
  - - [128, 2048, 1, 2048, 128, 128, 128, 2048]
    - [74, 4.606]
  - - [128, 2048, 1, 4096, 128, 128, 128, 2048]
    - [17, 7.124]
  - - [128, 2048, 1, 8192, 128, 128, 128, 2048]
    - [73, 9.409]
  - - [128, 4096, 1, 128, 128, 128, 128, 4096]
    - [50, 1.441]
  - - [128, 4096, 1, 256, 128, 128, 128, 4096]
    - [53, 2.213]
  - - [128, 4096, 1, 512, 128, 128, 128, 4096]
    - [48, 3.309]
  - - [128, 4096, 1, 1024, 128, 128, 128, 4096]
    - [62, 5.236]
  - - [128, 4096, 1, 2048, 128, 128, 128, 4096]
    - [72, 8.442]
  - - [128, 4096, 1, 4096, 128, 128, 128, 4096]
    - [74, 10.766]
  - - [128, 4096, 1, 8192, 128, 128, 128, 4096]
    - [68, 13.191]
  - - [128, 8192, 1, 128, 128, 128, 128, 8192]
    - [61, 2.543]
  - - [128, 8192, 1, 256, 128, 128, 128, 8192]
    - [72, 3.86]
  - - [128, 8192, 1, 512, 128, 128, 128, 8192]
    - [71, 6.25]
  - - [128, 8192, 1, 1024, 128, 128, 128, 8192]
    - [71, 9.202]
  - - [128, 8192, 1, 2048, 128, 128, 128, 8192]
    - [71, 11.395]
  - - [128, 8192, 1, 4096, 128, 128, 128, 8192]
    - [67, 14.743]
  - - [128, 8192, 1, 8192, 128, 128, 128, 8192]
    - [32, 19.319]
  - - [256, 128, 1, 128, 256, 256, 256, 128]
    - [51, 0.1]
  - - [256, 128, 1, 256, 256, 256, 256, 128]
    - [51, 0.157]
  - - [256, 128, 1, 512, 256, 256, 256, 128]
    - [55, 0.212]
  - - [256, 128, 1, 1024, 256, 256, 256, 128]
    - [55, 0.293]
  - - [256, 128, 1, 2048, 256, 256, 256, 128]
    - [51, 0.622]
  - - [256, 128, 1, 4096, 256, 256, 256, 128]
    - [55, 1.186]
  - - [256, 128, 1, 8192, 256, 256, 256, 128]
    - [55, 2.004]
  - - [256, 256, 1, 128, 256, 256, 256, 256]
    - [51, 0.195]
  - - [256, 256, 1, 256, 256, 256, 256, 256]
    - [55, 0.305]
  - - [256, 256, 1, 512, 256, 256, 256, 256]
    - [55, 0.473]
  - - [256, 256, 1, 1024, 256, 256, 256, 256]
    - [51, 0.913]
  - - [256, 256, 1, 2048, 256, 256, 256, 256]
    - [51, 1.578]
  - - [256, 256, 1, 4096, 256, 256, 256, 256]
    - [55, 2.519]
  - - [256, 256, 1, 8192, 256, 256, 256, 256]
    - [55, 3.497]
  - - [256, 512, 1, 128, 256, 256, 256, 512]
    - [55, 0.368]
  - - [256, 512, 1, 256, 256, 256, 256, 512]
    - [55, 0.643]
  - - [256, 512, 1, 512, 256, 256, 256, 512]
    - [55, 1.078]
  - - [256, 512, 1, 1024, 256, 256, 256, 512]
    - [55, 1.828]
  - - [256, 512, 1, 2048, 256, 256, 256, 512]
    - [51, 2.875]
  - - [256, 512, 1, 4096, 256, 256, 256, 512]
    - [52, 4.033]
  - - [256, 512, 1, 8192, 256, 256, 256, 512]
    - [52, 5.66]
  - - [256, 1024, 1, 128, 256, 256, 256, 1024]
    - [55, 0.77]
  - - [256, 1024, 1, 256, 256, 256, 256, 1024]
    - [51, 1.265]
  - - [256, 1024, 1, 512, 256, 256, 256, 1024]
    - [51, 1.99]
  - - [256, 1024, 1, 1024, 256, 256, 256, 1024]
    - [50, 3.052]
  - - [256, 1024, 1, 2048, 256, 256, 256, 1024]
    - [73, 4.642]
  - - [256, 1024, 1, 4096, 256, 256, 256, 1024]
    - [72, 7.037]
  - - [256, 1024, 1, 8192, 256, 256, 256, 1024]
    - [73, 9.228]
  - - [256, 2048, 1, 128, 256, 256, 256, 2048]
    - [50, 1.436]
  - - [256, 2048, 1, 256, 256, 256, 256, 2048]
    - [54, 2.263]
  - - [256, 2048, 1, 512, 256, 256, 256, 2048]
    - [48, 3.378]
  - - [256, 2048, 1, 1024, 256, 256, 256, 2048]
    - [17, 5.278]
  - - [256, 2048, 1, 2048, 256, 256, 256, 2048]
    - [71, 8.305]
  - - [256, 2048, 1, 4096, 256, 256, 256, 2048]
    - [74, 10.746]
  - - [256, 2048, 1, 8192, 256, 256, 256, 2048]
    - [67, 13.155]
  - - [256, 4096, 1, 128, 256, 256, 256, 4096]
    - [61, 2.55]
  - - [256, 4096, 1, 256, 256, 256, 256, 4096]
    - [71, 4.104]
  - - [256, 4096, 1, 512, 256, 256, 256, 4096]
    - [71, 6.338]
  - - [256, 4096, 1, 1024, 256, 256, 256, 4096]
    - [72, 9.442]
  - - [256, 4096, 1, 2048, 256, 256, 256, 4096]
    - [69, 11.563]
  - - [256, 4096, 1, 4096, 256, 256, 256, 4096]
    - [70, 14.866]
  - - [256, 4096, 1, 8192, 256, 256, 256, 4096]
    - [47, 19.098]
  - - [256, 8192, 1, 128, 256, 256, 256, 8192]
    - [57, 3.943]
  - - [256, 8192, 1, 256, 256, 256, 256, 8192]
    - [57, 5.569]
  - - [256, 8192, 1, 512, 256, 256, 256, 8192]
    - [72, 8.667]
  - - [256, 8192, 1, 1024, 256, 256, 256, 8192]
    - [67, 12.068]
  - - [256, 8192, 1, 2048, 256, 256, 256, 8192]
    - [45, 15.49]
  - - [256, 8192, 1, 4096, 256, 256, 256, 8192]
    - [82, 20.392]
  - - [256, 8192, 1, 8192, 256, 256, 256, 8192]
    - [29, 22.789]
  - - [512, 128, 1, 128, 512, 512, 512, 128]
    - [51, 0.2]
  - - [512, 128, 1, 256, 512, 512, 512, 128]
    - [55, 0.312]
  - - [512, 128, 1, 512, 512, 512, 512, 128]
    - [55, 0.474]
  - - [512, 128, 1, 1024, 512, 512, 512, 128]
    - [55, 0.9]
  - - [512, 128, 1, 2048, 512, 512, 512, 128]
    - [51, 1.557]
  - - [512, 128, 1, 4096, 512, 512, 512, 128]
    - [55, 2.474]
  - - [512, 128, 1, 8192, 512, 512, 512, 128]
    - [56, 3.524]
  - - [512, 256, 1, 128, 512, 512, 512, 256]
    - [55, 0.377]
  - - [512, 256, 1, 256, 512, 512, 512, 256]
    - [55, 0.641]
  - - [512, 256, 1, 512, 512, 512, 512, 256]
    - [55, 1.067]
  - - [512, 256, 1, 1024, 512, 512, 512, 256]
    - [51, 1.795]
  - - [512, 256, 1, 2048, 512, 512, 512, 256]
    - [51, 2.875]
  - - [512, 256, 1, 4096, 512, 512, 512, 256]
    - [53, 4.082]
  - - [512, 256, 1, 8192, 512, 512, 512, 256]
    - [54, 5.631]
  - - [512, 512, 1, 128, 512, 512, 512, 512]
    - [51, 0.783]
  - - [512, 512, 1, 256, 512, 512, 512, 512]
    - [51, 1.258]
  - - [512, 512, 1, 512, 512, 512, 512, 512]
    - [51, 1.981]
  - - [512, 512, 1, 1024, 512, 512, 512, 512]
    - [50, 3.063]
  - - [512, 512, 1, 2048, 512, 512, 512, 512]
    - [53, 4.581]
  - - [512, 512, 1, 4096, 512, 512, 512, 512]
    - [23, 7.114]
  - - [512, 512, 1, 8192, 512, 512, 512, 512]
    - [23, 9.166]
  - - [512, 1024, 1, 128, 512, 512, 512, 1024]
    - [50, 1.393]
  - - [512, 1024, 1, 256, 512, 512, 512, 1024]
    - [54, 2.262]
  - - [512, 1024, 1, 512, 512, 512, 512, 1024]
    - [54, 3.415]
  - - [512, 1024, 1, 1024, 512, 512, 512, 1024]
    - [17, 5.397]
  - - [512, 1024, 1, 2048, 512, 512, 512, 1024]
    - [71, 8.559]
  - - [512, 1024, 1, 4096, 512, 512, 512, 1024]
    - [74, 10.273]
  - - [512, 1024, 1, 8192, 512, 512, 512, 1024]
    - [68, 12.562]
  - - [512, 2048, 1, 128, 512, 512, 512, 2048]
    - [61, 2.547]
  - - [512, 2048, 1, 256, 512, 512, 512, 2048]
    - [71, 4.152]
  - - [512, 2048, 1, 512, 512, 512, 512, 2048]
    - [71, 6.23]
  - - [512, 2048, 1, 1024, 512, 512, 512, 2048]
    - [71, 9.383]
  - - [512, 2048, 1, 2048, 512, 512, 512, 2048]
    - [71, 11.336]
  - - [512, 2048, 1, 4096, 512, 512, 512, 2048]
    - [67, 13.997]
  - - [512, 2048, 1, 8192, 512, 512, 512, 2048]
    - [80, 18.792]
  - - [512, 4096, 1, 128, 512, 512, 512, 4096]
    - [59, 3.948]
  - - [512, 4096, 1, 256, 512, 512, 512, 4096]
    - [58, 5.743]
  - - [512, 4096, 1, 512, 512, 512, 512, 4096]
    - [64, 8.945]
  - - [512, 4096, 1, 1024, 512, 512, 512, 4096]
    - [67, 12.427]
  - - [512, 4096, 1, 2048, 512, 512, 512, 4096]
    - [47, 15.363]
  - - [512, 4096, 1, 4096, 512, 512, 512, 4096]
    - [46, 20.154]
  - - [512, 4096, 1, 8192, 512, 512, 512, 4096]
    - [46, 22.337]
  - - [512, 8192, 1, 128, 512, 512, 512, 8192]
    - [76, 5.703]
  - - [512, 8192, 1, 256, 512, 512, 512, 8192]
    - [75, 8.038]
  - - [512, 8192, 1, 512, 512, 512, 512, 8192]
    - [20, 11.709]
  - - [512, 8192, 1, 1024, 512, 512, 512, 8192]
    - [82, 16.098]
  - - [512, 8192, 1, 2048, 512, 512, 512, 8192]
    - [81, 20.342]
  - - [512, 8192, 1, 4096, 512, 512, 512, 8192]
    - [7, 23.036]
  - - [512, 8192, 1, 8192, 512, 512, 512, 8192]
    - [28, 26.601]
  - - [1024, 128, 1, 128, 1024, 1024, 1024, 128]
    - [55, 0.367]
  - - [1024, 128, 1, 256, 1024, 1024, 1024, 128]
    - [56, 0.62]
  - - [1024, 128, 1, 512, 1024, 1024, 1024, 128]
    - [55, 1.05]
  - - [1024, 128, 1, 1024, 1024, 1024, 1024, 128]
    - [55, 1.805]
  - - [1024, 128, 1, 2048, 1024, 1024, 1024, 128]
    - [55, 2.777]
  - - [1024, 128, 1, 4096, 1024, 1024, 1024, 128]
    - [49, 4.052]
  - - [1024, 128, 1, 8192, 1024, 1024, 1024, 128]
    - [17, 5.803]
  - - [1024, 256, 1, 128, 1024, 1024, 1024, 256]
    - [51, 0.785]
  - - [1024, 256, 1, 256, 1024, 1024, 1024, 256]
    - [51, 1.261]
  - - [1024, 256, 1, 512, 1024, 1024, 1024, 256]
    - [51, 2.019]
  - - [1024, 256, 1, 1024, 1024, 1024, 1024, 256]
    - [51, 3.06]
  - - [1024, 256, 1, 2048, 1024, 1024, 1024, 256]
    - [72, 4.596]
  - - [1024, 256, 1, 4096, 1024, 1024, 1024, 256]
    - [17, 7.25]
  - - [1024, 256, 1, 8192, 1024, 1024, 1024, 256]
    - [72, 9.239]
  - - [1024, 512, 1, 128, 1024, 1024, 1024, 512]
    - [50, 1.445]
  - - [1024, 512, 1, 256, 1024, 1024, 1024, 512]
    - [54, 2.256]
  - - [1024, 512, 1, 512, 1024, 1024, 1024, 512]
    - [54, 3.401]
  - - [1024, 512, 1, 1024, 1024, 1024, 1024, 512]
    - [18, 5.366]
  - - [1024, 512, 1, 2048, 1024, 1024, 1024, 512]
    - [17, 8.294]
  - - [1024, 512, 1, 4096, 1024, 1024, 1024, 512]
    - [72, 10.383]
  - - [1024, 512, 1, 8192, 1024, 1024, 1024, 512]
    - [63, 12.741]
  - - [1024, 1024, 1, 128, 1024, 1024, 1024, 1024]
    - [61, 2.574]
  - - [1024, 1024, 1, 256, 1024, 1024, 1024, 1024]
    - [71, 4.036]
  - - [1024, 1024, 1, 512, 1024, 1024, 1024, 1024]
    - [71, 6.34]
  - - [1024, 1024, 1, 1024, 1024, 1024, 1024, 1024]
    - [71, 9.536]
  - - [1024, 1024, 1, 2048, 1024, 1024, 1024, 1024]
    - [74, 11.251]
  - - [1024, 1024, 1, 4096, 1024, 1024, 1024, 1024]
    - [45, 13.661]
  - - [1024, 1024, 1, 8192, 1024, 1024, 1024, 1024]
    - [45, 17.917]
  - - [1024, 2048, 1, 128, 1024, 1024, 1024, 2048]
    - [57, 3.983]
  - - [1024, 2048, 1, 256, 1024, 1024, 1024, 2048]
    - [71, 5.58]
  - - [1024, 2048, 1, 512, 1024, 1024, 1024, 2048]
    - [64, 8.781]
  - - [1024, 2048, 1, 1024, 1024, 1024, 1024, 2048]
    - [67, 12.129]
  - - [1024, 2048, 1, 2048, 1024, 1024, 1024, 2048]
    - [45, 15.185]
  - - [1024, 2048, 1, 4096, 1024, 1024, 1024, 2048]
    - [45, 19.349]
  - - [1024, 2048, 1, 8192, 1024, 1024, 1024, 2048]
    - [79, 21.999]
  - - [1024, 4096, 1, 128, 1024, 1024, 1024, 4096]
    - [77, 5.606]
  - - [1024, 4096, 1, 256, 1024, 1024, 1024, 4096]
    - [75, 8.21]
  - - [1024, 4096, 1, 512, 1024, 1024, 1024, 4096]
    - [22, 11.781]
  - - [1024, 4096, 1, 1024, 1024, 1024, 1024, 4096]
    - [80, 16.564]
  - - [1024, 4096, 1, 2048, 1024, 1024, 1024, 4096]
    - [81, 19.973]
  - - [1024, 4096, 1, 4096, 1024, 1024, 1024, 4096]
    - [6, 22.735]
  - - [1024, 4096, 1, 8192, 1024, 1024, 1024, 4096]
    - [34, 26.375]
  - - [1024, 8192, 1, 128, 1024, 1024, 1024, 8192]
    - [77, 7.791]
  - - [1024, 8192, 1, 256, 1024, 1024, 1024, 8192]
    - [69, 10.172]
  - - [1024, 8192, 1, 512, 1024, 1024, 1024, 8192]
    - [79, 15.516]
  - - [1024, 8192, 1, 1024, 1024, 1024, 1024, 8192]
    - [79, 20.461]
  - - [1024, 8192, 1, 2048, 1024, 1024, 1024, 8192]
    - [43, 23.034]
  - - [1024, 8192, 1, 4096, 1024, 1024, 1024, 8192]
    - [36, 26.499]
  - - [1024, 8192, 1, 8192, 1024, 1024, 1024, 8192]
    - [0, 31.271]
  - - [2048, 128, 1, 128, 2048, 2048, 2048, 128]
    - [51, 0.753]
  - - [2048, 128, 1, 256, 2048, 2048, 2048, 128]
    - [51, 1.227]
  - - [2048, 128, 1, 512, 2048, 2048, 2048, 128]
    - [51, 2.015]
  - - [2048, 128, 1, 1024, 2048, 2048, 2048, 128]
    - [48, 3.007]
  - - [2048, 128, 1, 2048, 2048, 2048, 2048, 128]
    - [71, 4.593]
  - - [2048, 128, 1, 4096, 2048, 2048, 2048, 128]
    - [17, 7.393]
  - - [2048, 128, 1, 8192, 2048, 2048, 2048, 128]
    - [71, 9.38]
  - - [2048, 256, 1, 128, 2048, 2048, 2048, 256]
    - [54, 1.421]
  - - [2048, 256, 1, 256, 2048, 2048, 2048, 256]
    - [54, 2.236]
  - - [2048, 256, 1, 512, 2048, 2048, 2048, 256]
    - [48, 3.325]
  - - [2048, 256, 1, 1024, 2048, 2048, 2048, 256]
    - [62, 5.376]
  - - [2048, 256, 1, 2048, 2048, 2048, 2048, 256]
    - [73, 8.272]
  - - [2048, 256, 1, 4096, 2048, 2048, 2048, 256]
    - [71, 10.375]
  - - [2048, 256, 1, 8192, 2048, 2048, 2048, 256]
    - [65, 13.082]
  - - [2048, 512, 1, 128, 2048, 2048, 2048, 512]
    - [61, 2.54]
  - - [2048, 512, 1, 256, 2048, 2048, 2048, 512]
    - [71, 4.094]
  - - [2048, 512, 1, 512, 2048, 2048, 2048, 512]
    - [72, 6.378]
  - - [2048, 512, 1, 1024, 2048, 2048, 2048, 512]
    - [73, 9.105]
  - - [2048, 512, 1, 2048, 2048, 2048, 2048, 512]
    - [16, 11.381]
  - - [2048, 512, 1, 4096, 2048, 2048, 2048, 512]
    - [45, 14.072]
  - - [2048, 512, 1, 8192, 2048, 2048, 2048, 512]
    - [47, 18.949]
  - - [2048, 1024, 1, 128, 2048, 2048, 2048, 1024]
    - [59, 3.958]
  - - [2048, 1024, 1, 256, 2048, 2048, 2048, 1024]
    - [71, 5.631]
  - - [2048, 1024, 1, 512, 2048, 2048, 2048, 1024]
    - [67, 8.799]
  - - [2048, 1024, 1, 1024, 2048, 2048, 2048, 1024]
    - [66, 12.034]
  - - [2048, 1024, 1, 2048, 2048, 2048, 2048, 1024]
    - [44, 14.963]
  - - [2048, 1024, 1, 4096, 2048, 2048, 2048, 1024]
    - [44, 19.206]
  - - [2048, 1024, 1, 8192, 2048, 2048, 2048, 1024]
    - [14, 21.892]
  - - [2048, 2048, 1, 128, 2048, 2048, 2048, 2048]
    - [75, 5.718]
  - - [2048, 2048, 1, 256, 2048, 2048, 2048, 2048]
    - [75, 7.997]
  - - [2048, 2048, 1, 512, 2048, 2048, 2048, 2048]
    - [63, 11.361]
  - - [2048, 2048, 1, 1024, 2048, 2048, 2048, 2048]
    - [79, 15.843]
  - - [2048, 2048, 1, 2048, 2048, 2048, 2048, 2048]
    - [44, 20.301]
  - - [2048, 2048, 1, 4096, 2048, 2048, 2048, 2048]
    - [40, 22.915]
  - - [2048, 2048, 1, 8192, 2048, 2048, 2048, 2048]
    - [40, 25.936]
  - - [2048, 4096, 1, 128, 2048, 2048, 2048, 4096]
    - [78, 7.786]
  - - [2048, 4096, 1, 256, 2048, 2048, 2048, 4096]
    - [67, 10.129]
  - - [2048, 4096, 1, 512, 2048, 2048, 2048, 4096]
    - [79, 15.485]
  - - [2048, 4096, 1, 1024, 2048, 2048, 2048, 4096]
    - [80, 20.159]
  - - [2048, 4096, 1, 2048, 2048, 2048, 2048, 4096]
    - [41, 22.775]
  - - [2048, 4096, 1, 4096, 2048, 2048, 2048, 4096]
    - [3, 26.355]
  - - [2048, 4096, 1, 8192, 2048, 2048, 2048, 4096]
    - [2, 31.125]
  - - [2048, 8192, 1, 128, 2048, 2048, 2048, 8192]
    - [79, 9.066]
  - - [2048, 8192, 1, 256, 2048, 2048, 2048, 8192]
    - [80, 13.859]
  - - [2048, 8192, 1, 512, 2048, 2048, 2048, 8192]
    - [13, 18.629]
  - - [2048, 8192, 1, 1024, 2048, 2048, 2048, 8192]
    - [5, 22.571]
  - - [2048, 8192, 1, 2048, 2048, 2048, 2048, 8192]
    - [8, 26.493]
  - - [2048, 8192, 1, 4096, 2048, 2048, 2048, 8192]
    - [33, 30.75]
  - - [2048, 8192, 1, 8192, 2048, 2048, 2048, 8192]
    - [11, 34.139]
  - - [4096, 128, 1, 128, 4096, 4096, 4096, 128]
    - [49, 1.445]
  - - [4096, 128, 1, 256, 4096, 4096, 4096, 128]
    - [53, 2.245]
  - - [4096, 128, 1, 512, 4096, 4096, 4096, 128]
    - [50, 3.326]
  - - [4096, 128, 1, 1024, 4096, 4096, 4096, 128]
    - [61, 5.347]
  - - [4096, 128, 1, 2048, 4096, 4096, 4096, 128]
    - [73, 8.339]
  - - [4096, 128, 1, 4096, 4096, 4096, 4096, 128]
    - [61, 10.19]
  - - [4096, 128, 1, 8192, 4096, 4096, 4096, 128]
    - [65, 12.978]
  - - [4096, 256, 1, 128, 4096, 4096, 4096, 256]
    - [62, 2.584]
  - - [4096, 256, 1, 256, 4096, 4096, 4096, 256]
    - [71, 4.145]
  - - [4096, 256, 1, 512, 4096, 4096, 4096, 256]
    - [72, 6.25]
  - - [4096, 256, 1, 1024, 4096, 4096, 4096, 256]
    - [74, 9.145]
  - - [4096, 256, 1, 2048, 4096, 4096, 4096, 256]
    - [16, 11.69]
  - - [4096, 256, 1, 4096, 4096, 4096, 4096, 256]
    - [63, 14.264]
  - - [4096, 256, 1, 8192, 4096, 4096, 4096, 256]
    - [47, 18.918]
  - - [4096, 512, 1, 128, 4096, 4096, 4096, 512]
    - [60, 3.955]
  - - [4096, 512, 1, 256, 4096, 4096, 4096, 512]
    - [60, 5.664]
  - - [4096, 512, 1, 512, 4096, 4096, 4096, 512]
    - [66, 8.924]
  - - [4096, 512, 1, 1024, 4096, 4096, 4096, 512]
    - [69, 12.435]
  - - [4096, 512, 1, 2048, 4096, 4096, 4096, 512]
    - [44, 15.158]
  - - [4096, 512, 1, 4096, 4096, 4096, 4096, 512]
    - [82, 19.924]
  - - [4096, 512, 1, 8192, 4096, 4096, 4096, 512]
    - [38, 22.542]
  - - [4096, 1024, 1, 128, 4096, 4096, 4096, 1024]
    - [77, 5.66]
  - - [4096, 1024, 1, 256, 4096, 4096, 4096, 1024]
    - [77, 7.942]
  - - [4096, 1024, 1, 512, 4096, 4096, 4096, 1024]
    - [21, 11.466]
  - - [4096, 1024, 1, 1024, 4096, 4096, 4096, 1024]
    - [82, 16.119]
  - - [4096, 1024, 1, 2048, 4096, 4096, 4096, 1024]
    - [47, 19.91]
  - - [4096, 1024, 1, 4096, 4096, 4096, 4096, 1024]
    - [39, 22.695]
  - - [4096, 1024, 1, 8192, 4096, 4096, 4096, 1024]
    - [24, 25.631]
  - - [4096, 2048, 1, 128, 4096, 4096, 4096, 2048]
    - [77, 7.686]
  - - [4096, 2048, 1, 256, 4096, 4096, 4096, 2048]
    - [67, 10.366]
  - - [4096, 2048, 1, 512, 4096, 4096, 4096, 2048]
    - [81, 14.991]
  - - [4096, 2048, 1, 1024, 4096, 4096, 4096, 2048]
    - [81, 19.928]
  - - [4096, 2048, 1, 2048, 4096, 4096, 4096, 2048]
    - [12, 22.527]
  - - [4096, 2048, 1, 4096, 4096, 4096, 4096, 2048]
    - [36, 26.415]
  - - [4096, 2048, 1, 8192, 4096, 4096, 4096, 2048]
    - [36, 31.059]
  - - [4096, 4096, 1, 128, 4096, 4096, 4096, 4096]
    - [78, 9.087]
  - - [4096, 4096, 1, 256, 4096, 4096, 4096, 4096]
    - [78, 13.295]
  - - [4096, 4096, 1, 512, 4096, 4096, 4096, 4096]
    - [38, 17.978]
  - - [4096, 4096, 1, 1024, 4096, 4096, 4096, 4096]
    - [4, 23.089]
  - - [4096, 4096, 1, 2048, 4096, 4096, 4096, 4096]
    - [2, 26.084]
  - - [4096, 4096, 1, 4096, 4096, 4096, 4096, 4096]
    - [33, 30.506]
  - - [4096, 4096, 1, 8192, 4096, 4096, 4096, 4096]
    - [8, 33.879]
  - - [4096, 8192, 1, 128, 4096, 4096, 4096, 8192]
    - [80, 10.457]
  - - [4096, 8192, 1, 256, 4096, 4096, 4096, 8192]
    - [44, 14.596]
  - - [4096, 8192, 1, 512, 4096, 4096, 4096, 8192]
    - [43, 20.135]
  - - [4096, 8192, 1, 1024, 4096, 4096, 4096, 8192]
    - [33, 25.784]
  - - [4096, 8192, 1, 2048, 4096, 4096, 4096, 8192]
    - [34, 30.291]
  - - [4096, 8192, 1, 4096, 4096, 4096, 4096, 8192]
    - [9, 33.543]
  - - [4096, 8192, 1, 8192, 4096, 4096, 4096, 8192]
    - [34, 34.936]
  - - [8192, 128, 1, 128, 8192, 8192, 8192, 128]
    - [61, 2.559]
  - - [8192, 128, 1, 256, 8192, 8192, 8192, 128]
    - [72, 3.774]
  - - [8192, 128, 1, 512, 8192, 8192, 8192, 128]
    - [74, 6.151]
  - - [8192, 128, 1, 1024, 8192, 8192, 8192, 128]
    - [73, 9.145]
  - - [8192, 128, 1, 2048, 8192, 8192, 8192, 128]
    - [19, 11.442]
  - - [8192, 128, 1, 4096, 8192, 8192, 8192, 128]
    - [64, 14.419]
  - - [8192, 128, 1, 8192, 8192, 8192, 8192, 128]
    - [32, 19.056]
  - - [8192, 256, 1, 128, 8192, 8192, 8192, 256]
    - [61, 3.929]
  - - [8192, 256, 1, 256, 8192, 8192, 8192, 256]
    - [71, 5.445]
  - - [8192, 256, 1, 512, 8192, 8192, 8192, 256]
    - [73, 8.603]
  - - [8192, 256, 1, 1024, 8192, 8192, 8192, 256]
    - [69, 11.979]
  - - [8192, 256, 1, 2048, 8192, 8192, 8192, 256]
    - [30, 15.385]
  - - [8192, 256, 1, 4096, 8192, 8192, 8192, 256]
    - [31, 20.168]
  - - [8192, 256, 1, 8192, 8192, 8192, 8192, 256]
    - [26, 22.899]
  - - [8192, 512, 1, 128, 8192, 8192, 8192, 512]
    - [77, 5.678]
  - - [8192, 512, 1, 256, 8192, 8192, 8192, 512]
    - [77, 8.013]
  - - [8192, 512, 1, 512, 8192, 8192, 8192, 512]
    - [21, 11.637]
  - - [8192, 512, 1, 1024, 8192, 8192, 8192, 512]
    - [82, 16.463]
  - - [8192, 512, 1, 2048, 8192, 8192, 8192, 512]
    - [44, 20.301]
  - - [8192, 512, 1, 4096, 8192, 8192, 8192, 512]
    - [40, 23.25]
  - - [8192, 512, 1, 8192, 8192, 8192, 8192, 512]
    - [27, 26.564]
  - - [8192, 1024, 1, 128, 8192, 8192, 8192, 1024]
    - [75, 7.473]
  - - [8192, 1024, 1, 256, 8192, 8192, 8192, 1024]
    - [66, 10.061]
  - - [8192, 1024, 1, 512, 8192, 8192, 8192, 1024]
    - [47, 15.18]
  - - [8192, 1024, 1, 1024, 8192, 8192, 8192, 1024]
    - [46, 20.093]
  - - [8192, 1024, 1, 2048, 8192, 8192, 8192, 1024]
    - [27, 22.695]
  - - [8192, 1024, 1, 4096, 8192, 8192, 8192, 1024]
    - [27, 26.17]
  - - [8192, 1024, 1, 8192, 8192, 8192, 8192, 1024]
    - [24, 30.932]
  - - [8192, 2048, 1, 128, 8192, 8192, 8192, 2048]
    - [81, 8.827]
  - - [8192, 2048, 1, 256, 8192, 8192, 8192, 2048]
    - [81, 13.271]
  - - [8192, 2048, 1, 512, 8192, 8192, 8192, 2048]
    - [15, 17.95]
  - - [8192, 2048, 1, 1024, 8192, 8192, 8192, 2048]
    - [37, 22.8]
  - - [8192, 2048, 1, 2048, 8192, 8192, 8192, 2048]
    - [38, 26.212]
  - - [8192, 2048, 1, 4096, 8192, 8192, 8192, 2048]
    - [36, 30.681]
  - - [8192, 2048, 1, 8192, 8192, 8192, 8192, 2048]
    - [10, 33.906]
  - - [8192, 4096, 1, 128, 8192, 8192, 8192, 4096]
    - [78, 9.983]
  - - [8192, 4096, 1, 256, 8192, 8192, 8192, 4096]
    - [46, 14.529]
  - - [8192, 4096, 1, 512, 8192, 8192, 8192, 4096]
    - [37, 20.15]
  - - [8192, 4096, 1, 1024, 8192, 8192, 8192, 4096]
    - [34, 26.189]
  - - [8192, 4096, 1, 2048, 8192, 8192, 8192, 4096]
    - [1, 30.219]
  - - [8192, 4096, 1, 4096, 8192, 8192, 8192, 4096]
    - [9, 33.673]
  - - [8192, 4096, 1, 8192, 8192, 8192, 8192, 4096]
    - [35, 34.915]
  - - [8192, 8192, 1, 128, 8192, 8192, 8192, 8192]
    - [42, 10.715]
  - - [8192, 8192, 1, 256, 8192, 8192, 8192, 8192]
    - [42, 16.304]
  - - [8192, 8192, 1, 512, 8192, 8192, 8192, 8192]
    - [43, 21.99]
  - - [8192, 8192, 1, 1024, 8192, 8192, 8192, 8192]
    - [9, 28.777]
  - - [8192, 8192, 1, 2048, 8192, 8192, 8192, 8192]
    - [25, 33.761]
  - - [8192, 8192, 1, 4096, 8192, 8192, 8192, 8192]
    - [24, 35.831]
  - - [8192, 8192, 1, 8192, 8192, 8192, 8192, 8192]
    - [24, 37.143]
- null
- null
- DeviceEfficiency
- GridBased
